,sentence
5334,이 후보자 “출연금 아닌 기부금…업체 이익 대변한 적 없어 이주호 사회부총리 겸 교육부 장관 후보자가 사단법인 설립 당시 사교육업체 대표의 출연금을 받아 공동투자해 설립한 것으로 나타났다.
5335,/뉴시스이주호 사회부총리 겸 교육부 장관 후보자가 사단법인 설립 당시 사교육업체 대표의 출연금을 받아 공동투자해 설립한 것으로 나타났다.
5336,이에 A씨가 협회 출연금과 후원금 등 이 후보자를 지원해오면서 사교육 업계나 에듀테크 업체의 가교 역할을 한 것이 아니냐는 의혹이 나온다.
5337,안 의원은 후보자가 장관 퇴임 후 공교육 정상화를 위한 공적 활동을 한 것인지 아니면 사교육업체의 이해와 이익을 대변한 공생을 공적 활동으로 포장한 것인지 후보자의 분명한 해명이 필요하다고 말했다.
5338,하지만 이 후보자 측은 사교육업체의 이익을 대변하는 활동을 했다는 주장은 사실이 아니다라며 법인 초기 운영재산은 출연금이 아닌 기부금이며 출연금액에 따라 의결권이 주어지는 것이 아니다라고 선을 그었다.
5339,그러면서 비영리 사단법인의 특성상 일반 회사법인처럼 출연지분에 따라 의결권이 주어지는 것이 아니다라며 모든 회원 각자에게 동등한 의결권이 있으며 (이 후보자는) 무보수 비상근 이사장으로 재직했고 후보자 지명 즉시 이사장 직에서 사임했다고 말했다.
5340,한은 관계자는 환율 변동성 확대에도 불구하고 거주자의 해외증권투자 및 외국인의 국내증권투자 수요 감소 등에 주로 기인했다고 설명했다.
5341,코오롱티슈진 이날 거래재개 여부 심사 코오롱이 계열사인 코오롱티슈진에 대규모 투자를 결정했다는 소식에 강세를 보이고 있다.
5342,코오롱은 이번 투자에 대해 코오롱티슈진의 임상재원 확보를 통한 자회사 가치 증대가 목적이라고 밝혔다.
5343,/메타 제공										메타(옛 페이스북)가 매 분기 수조원을 쏟아부으며 개발 중인 메타버스가 여전히 지지부진하고 있다.
5344,메타버스 구축에 긴 시간이 필요하다고 해도 초반 성장세가 너무 약하다는 지적이다.
5345,이런 상황에서 메타의 주주인 미 실리콘밸리 투자사가 메타에게 메타버스 투자를 줄이라고 요구하고 나섰다.
5346,거스트너 CEO는 서한에서 “메타는 세계 최고의 사람들을 끌어들이고 이들에게 영감을 주기 위해 투자자 직원 기술 커뮤니티와 다시 신뢰를 쌓을 필요가 있다며 “메타는 건강해지고 집중할 필요가 있다고 했다.
5347,이는 사실상 메타가 추진하는 메타버스에 대해 믿지 못하겠다는 뜻으로 업계는 받아들였다.
5348,CNBC는 “거스트너의 주장은 메타의 메타버스를 향한 야망에 대한 불신임 투표라고 보도했다.
5349,/김성민 기자										특히 대부분의 접속자가 방문 첫 달이 지난 뒤 다시는 이 앱에 돌아오지 않고 이용자는 지난 봄 이후 꾸준히 감소하는 것으로 나타났다.
5350,코인데스크는 “메타버스가 기업을 중심으로 확산되고 있는 만큼 많은 잠재력을 내포하고 있지만 대대적으로 활용되기까지는 시간이 많이 소요될 것으로 보인다고 했다.
5351,/AFP 연합뉴스 거세지는 저커버그 책임론							막대한 돈을 쏟아붓는 메타버스가 대중성을 갖는데 현재까진 실패하자 마크 저커버그 메타 CEO에 대한 책임론도 나오고 있다.
5352,한 메타 고위 임원은 뉴욕타임스에 “메타버스 구축에 쏟은 지출 금액을 생각하면 속이 쓰리다고 말했다.
5353,저커버그의 ‘메타버스 올인 전략’이 현재 메타가 처한 상황을 악화시키고 있다는 것이다.
5354,내부에서는 주요 메타버스 프로젝트를 ‘MMH(Make Mark Happy·저커버그를 행복하게 만드는 것)’로 부른다고 뉴욕타임스는 보도했다.
5355,일각에선 저커버그가 메타를 떠나 메타버스 구축을 위한 별도 조직을 꾸려야 한다는 의견도 나온다.
5356,저커버그가 메타 CEO 자리에서 물러나고 자신의 비전인 메타버스 구축을 위한 스타트업을 시작하라는 것이 주요 내용이다.
5357,구체적으론 운용 직군의 △해외FI운용 △ETF운용 △ETF상품개발 △솔루션전략 △글로벌비즈니스 마케팅 직군의 △ETF마케팅 △리테일마케팅 △연금마케팅 관리 직군의 △경영기획/경영관리 △IT △트레이딩/오퍼레이션 등입니다.
5358,기업들이 올해 실적들을 정리하고 영업전략에 문제는 없었는지 돌아보는 시기 또 내년에는 어떻게 투자와 영업을 할 건지 계획들을 세우는 시기입니다.
5359,실적이 크게 줄어들거나 아예 적자가 발생했고 여기에 금리도 크게 올라서 투자를 위해 돈을 빌렸다가는 이자도 감당하기 힘든 상황입니다.
5360,SK하이닉스는 내년 투자를 절반 이상 감축하는 것을 고려 중이라고 밝혔고 LG디스플레이는 투자 축소와 함께 LCD 국내 생산중단 등 출구전략도 검토 중입니다.
5361,레고랜드 사태로 가장 직접적 영향을 받는 부동산 개발 대출 즉 프로젝트파이낸싱(PF) 자금 시장이 경색되면서 지방 건설사들은 줄도산 공포가 커졌습니다.
5362,특히 자금조달력이 떨어지는 기업이나 투자를 과도하게 늘린 기업들부터 나가떨어질 수 있다는 우려가 나오고 있습니다.
5363,강원도가 지급보증한 레고랜드 개발 대출 채권이 부도난 것을 계기로 신뢰의 위기가 발생 회사채 등 자금조달 시장에 돈의 흐름이 막히는 돈맥경화 현상이 발생했고 이것이 유동성 위기로 연결돼 그동안 우리 경제에 잠재해있던 문제가 한꺼번에 터져 나오는 상황입니다.
5364,정부가 경제를 세심하게 챙기고 있다는 모습을 보여줘서 불안을 잠재우겠다는 윤석열 대통령의 의지가 컸다는게 대통령실 설명입니다.
5365,대통령이 직접 나서는 오늘 공포로 얼어붙은 시장의 엔진을 다시 돌리는 계기가 될 수 있을까요?
5366,황진환 기자레고랜드 사태는 정치적으로는 야당의 공격 소재로 쓰이고 있습니다.
5367,시정연설 불참을 시작으로 본격적인 대정부 투쟁에 나선 더불어민주당은 김진태 강원지사의 채무불이행 선언에서 시작된 레고랜드 사태를 사자성어를 인용해 진태양난 즉 김진태발 금융위기라고 규정했습니다.
5368,최근의 물가 급등 수출 부진 등 경제가 안 좋은 상황에서 터진 레고랜드 사태를 고리로 정부 여당에 대한 공세 수위를 끌어 올리는 모습입니다.
5369,김 지사와 윤 대통령이 검사 출신이라는 점을 엮어 검찰 출신이 나라를 망치고 있다는 목소리도 터져 나왔습니다.
5370,여권은 검찰 수사 등으로 수세에 몰린 야권이 민생 문제를 부각하면서 국면 전환을 노리는 것이라고 반박하고 있습니다.
5371,검찰의 이재명 대표를 겨냥한 수사에 야당의 총공세 등 여야의 강대강 대치가 이어지면서 내년도 예산안 처리에도 험로가 예상됩니다.
5372,尹 최측근 국정원 기조실장 돌연 사표…국정원장도 몰랐다 조상준 국가정보원 기조실장.
5373,윤창원 기자조상준 국정원 기획조정실장이 어제 국정원에 대한 국정감사를 앞두고 돌연 사의를 표명했습니다.
5374,국정원은 일신 상의 사유로 알고 있고 구체적 내용은 확인할 수 없다고 밝혔습니다.
5375,그랬던 조 실장이 갑자기 사의를 표명하면서 일신 상의 사유라는 표면적 이유 외에 갑자기 사표를 던진 실제 이유가 무엇인지에 여론의 관심이 쏠리고 있습니다.
5376,한편 조 실장이 돌연 사직하는 과정에서 김규현 국정원장에게 사의를 알리지 않고 용산 대통령실에 직보한 사실이 드러나 최측근의 면모를 다시한번 드러내기도 했습니다.
5377,김규현 국정원장은 어제 국회 정보위 국정감사에서 조 실장 전화를 직접 받았느냐는 질의에 전화를 받지 않았다고 답변했고 이후 대통령실 소속 담당비서관의 전화로 조 실장 사의를 통보받은 것으로 전해집니다.
5378,야놀자 제공 파이낸셜뉴스 숙박·여행 플랫폼인 야놀자의 상장 소식에 잠잠하던 벤처캐피털주가 들썩였다.
5379,야놀자가 내년 상반기 미국 나스닥 입성을 목표로 본격적인 상장 준비에 들어갔다는 소식이 주가에 영향을 미친 것으로 풀이된다.
5380,이들 기업은 야놀자에 투자한 벤처캐피털(VC)로 야놀자 관련주로 분류되는 종목이다.
5381,벤처투자업계에 따르면 야놀자는 이르면 내년 상반기 나스닥 상장을 위해 외부인사 영입과 투자자 접촉에 나설 계획이라고 전해졌다.
5382,당초 야놀자는 연내 상장을 목표로 했지만 글로벌 기업공개(IPO) 시장이 얼어붙으면서 상장 일정을 미룬 것으로 알려졌다.
5383,한편 야놀자의 상장 기대감에 이웃한 업종과 테마들도 덩달아 오르는 현상이 나타나기도 했다.
5384,또한 국내 증시 상장을 준비하고 있는 (마켓)컬리 관련주도 이날 상승세를 보였다.
5385,업계에서는 국내 첫 상장을 노리는 창업기획자(액셀러레이터) 블루포인트파트너스의 상장 예비심사 통과와 더불어 벤처캐피털주에 훈풍이 불 것으로 기대하고 있다.
5386,벤처업계 관계자는 최근 기업공개(IPO) 시장이 얼어붙으면서 후방 산업인 벤처캐피털업계도 돈맥경화가 있었다라며 그러나 나스닥 상장 액셀러레이터 상장 등 엑시트(자금회수)와 사업자가 보다 다양해지면 벤처캐피털주에 대한 투자자들에 대한 관심도 제고될 것이라고 전했다.
5387,예탁원 ‘서비스 오픈 기념식’ 개최 (왼쪽부터)한국예탁결제원 이명근 본부장 삼성증권 배형근 담당 한화투자증권 정준 실장 신한투자증권 김장우 본부장 금융투자협회 성인모 수석 전무 예탁결제원 이명호 사장 예탁결제원 박철영 전무 미래에셋증권 장지현 본부장 NH투자증권 정병석 본부장 KB증권 하우성 본부장 키움증권 김희재 본부장.
5388,예탁결제원 이명호 사장은 “증권업계의 요구를 수용하고 자본시장의 혁신을 위해 오픈한 국내주식 소수단위 거래 서비스가 투자자의 고가 우량주에 대한 접근성 확대 소액 여유자금의 주식투자 활용 등으로 투자자 저변이 확대되고 자금 유입이 증가해 증권시장에 새로운 활력을 불어넣을 것이라 기대한다고 말했다.
5389,연구개발 인력 확충·혁신 제품 출시코웨이가 IT 인프라 투자를 확대해 디지털 전환 속도를 내고 있다.
5390,디지털 혁신을 통해 제품 경쟁력을 높이고 글로벌 환경가전 선도 기업으로서 지속 가능한 성장 동력을 확보하겠다는 전략이다.
5391,코웨이는 지난해 통합 IT 전담조직인 DX센터를 신설해 본격적인 디지털 전환에 착수했다.
5392,DX센터는 기존 IT 부서를 확대 재편한 조직으로 사물인터넷(IoT) 인공지능(AI) 등 첨단 기술을 접목한 제품과 서비스 플랫폼을 구축하는 역할을 담당한다.
5393,코웨이는 DX센터를 신설한 뒤 AI IoT 빅데이터 머신러닝 클라우드 등 IT 관련 인력을 대거 채용했다.
5394,코웨이 노블 정수기 시리즈 (사진코웨이)코웨이는 DX센터를 중심으로 그간 축적된 빅데이터와 디지털 기술을 활용해 스마트 기능을 탑재한 제품을 출시했다.
5395,이 제품은 고장 여부 정수기 사용 현황 필터와 유로 교체 날짜를 확인해 음성으로 안내한다.
5396,또한 코웨이는 디지털 기술을 활용해 손쉽게 정수기 제품을 자가 관리하는 스마트 필터 센싱 기술을 개발했다.
5397,스마트 필터 센싱은 자동으로 필터 수명을 체크해 교체 시기가 지나면 알람을 주고 필터 교체가 완료되면 새 필터를 감지해 자동으로 필터를 세척하는 기술이다.
5398,코웨이는 올해도 디지털 전환을 위한 IT 인프라 및 연구개발(R&amp;D) 투자를 확대해 나갈 계획이다.
5399,코웨이 관계자는 모든 영역에 걸쳐 IT 기술을 접목해 새로운 가치를 만드는 데 집중하고 있다며 앞으로도 상품·서비스·디자인 혁신과 함께 빠른 디지털 전환을 통해 기업 경쟁력을 한층 강화해 나갈 예정이다고 말했다.
5400,이후 머스크가 트위터 인수를 다시 추진한다고 밝히면서 미래에셋금융그룹의 이번 투자 참여도 진행된 것으로 보인다.
5401,트위터를 사겠다고 했다가 입장을 번복했던 머스크는 현재 계약을 이행하라며 트위터 측에 소송을 당한 상태다.
5402,이번 시설 투자 계약을 통해 GS칼텍스는 국내에서 발생하는 자동차 폐범퍼 뿐 아니라 자동차 내·외장재 플라스틱의 재활용이 가능한 설비를 에코지앤알에 지원해 대·중소기업간 지속가능한 상생 협력 생태계를 조성할 방침이다.
5403,GS칼텍스는 에코지앤알과의 장기 구매 계약을 통해 생산된 제품이 친환경 복합수지의 원재료로 안정적으로 소비될 수 있도록 지원할 예정이다.
5404,양사는 시설지원 및 기술협력을 통한 공동 연구개발을 추진해 자동차 발생 폐플라스틱의 재활용률을 높여 나갈 계획이다.
5405,이를 통해 향후 폐플라스틱 재활용 분야 전반에서 협업하며 지속가능한 상생모델을 구축하는 방안을 적극 논의해 나갈 방침이다.
5406,김형국 GS칼텍스 케미칼사업 본부장은 이번 양사간 시설투자 계약은 지속 가능한 순환경제 구축을 위한 대·중소기업 간 상생 협력의 모범적인 사례라며 앞으로도 폐플라스틱 재활용업을 하는 파트너사의 고유 사업 영역을 존중하고 구매 및 기술 지원 등을 통해 재활용 플라스틱이 고품질 고부가의 친환경 복합수지로 활용될 수 있도록 지속적으로 고민해 나갈 것이라고 밝혔다.
5407,참석자들은 세션 중 수준 높은 질문을 이어갔고 콘퍼런스가 끝난 뒤에는 UAM 연사들에게 몰려가기도 했습니다.
5408,&lt;기자&gt;UAM 시장을 대표하는 글로벌 기업들이 한자리에 모인다는 소식에 업계 관계자를 비롯한 참석자들은 이른 시간부터 자리를 메웠습니다.
5409,기체 제작과 관련해 현대차와 한국항공우주산업(KAI) 한화시스템 관계자가 참석했고 삼성SDI와 SK온 등 전기배터리를 생산하는 업계에서도 자리해 글로벌 연사에 귀 기울였습니다.
5410,그런 만큼 투자사를 포함한 건설과 통신 업계 실무자들도 대거 참석해 관심을 보였습니다.
5411,“특히 이날 행사는 미래모빌리티에 관심 있는 학생과 일반인들로 인산인해를 이뤘습니다.
5412,UAM에 대해 제대로 알기 어려웠던 참석자들은 청사진을 한눈에 그리는 시간이었습니다.
5413,청중 질문 (UAM은) 과도기 적으로 파일럿이 조종하는 형태의 비행이 될 것 같은데 파일럿 공급은 어떻게 되는 건지 궁금합니다UAM이 단순히 기체 제작에 그치는 것이 아니라 새로운 교통 지도를 만드는 일이라는 것을 깨달은 학생들은 진로에 대한 명쾌한 해답을 얻었습니다.
5414,임서현 / 항공대 스마트드론공학과 : 카카오T는 많이 사용하다 보니까 그 연설을 가장 인상 깊게 들었습니다.
5415,사용자들의 편리함을 우선적으로 생각한다는 게 인상 깊었고 앞으로 발전 가능성도 크다고 생각됐습니다윤준석 / 항공대 스마트드론공학과 : 에어버스에서 나온 eVTOL 시스템에 관해서 친환경적인 제품을 추구하는 에어버스 UAM에 대해 흥미롭게 봤는데요.
5416,저도 이제 UAM 쪽으로 진로를 생각하고 있다 보니까 더 관심 깊게 볼 수 있었던 것 같습니다UAM 관련 기업에 투자한 일반인들은 그동안 정보가 부족해 느꼈던 불확실성을 걷어내는 시간이었습니다.
5417,김기범 / 직장인 : 실제 와서 깊게 들은 것 같고 이 산업이 많은 회사에서 관심 갖고 있는 것이 더 느껴져서 저도 투자를 잘하고 있다고 생각됐습니다이번 쇼퍼런스는 ‘하늘의 테슬라’로 불리는 UAM 시장을 집중 조명하면서 그들만의 리그가 아닌 각계각층의 궁금증을 해결하는 자리가 됐습니다.
5418,‘휴폐업공장 제로화’ 박차 성과 기업 투자·지원에 관한 상호 협약 체결 경남 의령군 오태완 군수와 청정테크 조은경 대표가 협약식을 체결한 뒤 기념촬영을 하고 있다.
5419,조은경 대표는 “의령은 경남의 중심에 위치한 지리적 장점과 상대적으로 저렴한 용지매입 비용 그리고 무엇보다 의령군의 다양한 관심과 지원이 의령으로 투자하게 된 가장 큰 이유이다고 말했다.
5420,이어 “의령 투자를 기점으로 남부권 시장 대응력을 키워 제품 설치 및 유지관리 등 고객 대응 효율성을 높여 나가겠다.
5421,지역민 고용창출 등 의령군 산업경제 전반에 대표선수로 새로운 활력이 될 수 있도록 하겠다고 덧붙였다.
5422,오태완 군수는 “원자재 가격급등과 고금리 등 기업투자가 어려운 경제 상황임에도 불구하고 의령에 투자를 결정해주신 데 대하여 감사드린다며 “기업의 편에 서서 필요한 산업인프라 개선 방안을 모색하겠다.
5423,안정적으로 정착하고 성장할 수 있도록 행정 지원에 적극적으로 나서겠다고 했다.
5424,정치적인 구호도 아닌 경기 북부 발전시키려는 마음밖에당선되면 다시 와달라는 약속 지키기 위해 어제 하루 잤고 기뻤다연천군민 여러분과 이 자리에서 말로만 끝나는 게 아니고 바로 실천에 옮기려고 합니다.
5425,이날 주민들은 △연천군 노인회관과 장애인회관·마을회관·청소년인공지능(AI)센터 준공 △민통선 규제 완화 △군사 유휴지 사용 △공기업 유치 △도로 설치 △산업단지 인근 환경문제 △문화·의료·체육시설 확대 등 지역 현안과 의견을 김동연 지사에게 직접 건의했다.
5426,김 지사는 도지사 선거운동 기간 연천군을 두 번씩 찾을 만큼 농촌·농업 문제와 경기 북부지역 현안에 깊은 관심을 보였다.
5427,이날 행사는 김 지사가 연천을 다시 방문하겠다는 약속을 지킨 자리여서 그 의미를 더했다.
5428,김 지사는 선거 유세 때 내산리에 두 번 왔는데 그때 주민들이 여러 건의 사항을 말씀하시면서 지사로 당선되면 다시 한번 와달라고 하셨다며 약속을 지키기 위해 어제 와서 하루 잤고 정말 기뻤다고 소회를 밝혔다.
5429,경제부총리를 하면서 경기북부 지방의 성장잠재력을 누구보다도 분명하게 봤고 확신을 갖고 있다며 북부에서도 가장 북단이라고 할 수 있는 연천군을 발전시킬 수 있다면 경기 북부가 충분히 발전할 수 있다고 믿는다.
5430,경기도 제공김 지사는 경기북부특별자치도를 만들기 위해서는 경기 북부 지역별로 비전과 발전 계획을 만들면서 시민과 군민 여러분께 희망을 드려야 한다면서 단순한 희망 고문이 아니라 이렇게 되면 우리 시와 군이 변하겠구나 하는 확신을 보여줘야 한다.
5431,특히 경기북도를 특별자치도로 발전시키려고 하는 계획을 갖고 있는데 (이는) 정치적인 구호도 아니고 목적으로 하는 것도 아니다라며 오로지 경기 북부를 발전시키려는 마음밖에 없다고 강조했다.
5432,그렇게 되기까지 규제 풀어주고 투자해준다면 대한민국 성장의 심장으로 클 것이다.
5433,김동연 경기도지사 페이스북 캡처한편 김 지사는 이날 페이스북을 통해 연천군에 있는 민박집에서 전날 하룻밤 묵은 사연을 공개했다.
5434,그중 마지막 하나가 도지사가 되어 꼭 다시 한 번 찾아와 달라는 것이었다.
5435,김 지사는 맞손 토크가 끝난 뒤 연천군 미산면에서 친환경 벼 베기 일손 돕기에도 참여했다.
5436,김 지사는 직접 콤바인에 올라타 벼를 베고 농업인들의 애로사항을 청취했다.
5437,기사내용 요약셀바스AI 음성기술과 시어스랩 개방형 메타버스 플랫폼 융복합셀바스AI-위지윅스튜디오-시어스랩 메타버스 밸류체인 구축 셀바스AI는 시어스랩과 AI 에이전트(Agent) 및 메타버스를 포함한 신사업 분야에 대한 사업협력 계약을 체결했다.
5438,셀바스AI는 시어스랩과 AI 에이전트(Agent) 및 메타버스를 포함한 신사업 분야’에 대한 사업협력 계약을 체결했다.
5439,이번 사업 협력으로 시어스랩의 개방형 메타버스 플랫폼 미러시티(Mirror City)에 다양한 음성기술을 적용해 현실과 같은 사운드를 구현하고 메타버스 서비스 몰입도를 높인다는 계획이다.
5440,또 양사는 AI 에이전트 및 메타버스를 포함한 신규 사업 모델도 공동으로 발굴해 나갈 예정이다.
5441,셀바스AI는 디지털휴먼 디지털트윈에서 모습·행동·표정 등과 어울리는 목소리 제작을 통해 메타버스 서비스 몰입도를 극대화할 수 있는 음성기술을 보유하고 있다.
5442,셀바스AI 관계자는 “메타버스의 몰입감을 높이기 위해선 그래픽만큼이나 사운드가 중요하다.
5443,독자 보유한 음성기술로 각 메타버스 서비스에 알맞게 최적의 목소리로 정교하게 제작을 할 수 있어 사용자 몰입감을 최상으로 끌어 올릴 수 있다며 “위지윅스튜디오 시어스랩간 메타버스 밸류체인을 통해 새로운 패러다임을 제시하게 될 것이라고 말했다.
5444,정진욱 시어스랩 대표는 “셀바스 AI의 뛰어난 음성 기술을 시어스랩의 아바타 기술에 접목한다면 보다 지능화된 대화형 아바타 제공이 가능하며 또한 AI 에이전트 등의 다양한 영역으로 확장해 메타버스에서의 의미있는 융복합 사례를 만들 수 있을 것이라며 “양사의 기술 및 사업협력을 통해 다양한 영역에서 시너지를 만들어 나갈 것이라고 기대감을 전했다.
5445,허 회장은 오늘 서울 서초구 SPC 본사에서 기자회견을 열고 이번 사고에 대한 책임을 통감하며 국민 여러분의 엄중한 질책과 지적을 겸허히 받아들인다며 특히 고인 주변에서 함께 일했던 직원들의 충격과 슬픔을 회사가 먼저 헤아리고 배려하지 못해 진심으로 사과 드린다고 말했습니다.
5446,이어 회사는 관계당국의 조사에 성실히 임하고 있으며 정확한 사고 원인 파악과 후속 조치를 위해 노력하고 있다고 언급했습니다.
5447,그는 특히 사고 다음날 사고 장소 인근에서 작업이 진행됐던 것으로 확인됐다.
5448,이는 잘못된 일이라며 그 어떤 이유로도 설명될 수 없는 도저히 있을 수 없는 일이라고 생각한다고 말했습니다.
5449,이어 모두 제가 부족한 탓이며 평소 직원들에게 더 중요한 가치가 무엇인지 제대로 전하지 못한 저의 불찰이라고 덧붙였습니다.
5450,허 회장은 뼈를 깎는 노력으로 안전관리 강화는 물론 인간적인 존중과 배려의 문화를 정착시켜 신뢰받는 기업으로 거듭날 수 있도록 최선을 다하겠다고 말했습니다.
5451,황 사장은 고용노동부 인증을 받은 복수의 전문기관을 통해 전 사업장에 대한 산업안전보건진단을 금일부터 즉각 실시하겠다며 진단 결과를 반영해 안전 관련 설비를 즉시 도입하는 등 관련 투자를 확대하고 종합적인 안전관리 개선책을 수립해 실행하겠다고 말했습니다.
5452,황 사장은 또 사외 전문가와 현장직원이 참여하는 안전경영위원회를 구성 산업안전보건에 대한 독립된 활동을 보장하고 안전보건조치 실행 및 관리감독을 강화하겠다고 덧붙였습니다.
5453,아울러 산업안전보건 전담 인력을 확충하고 관련 조직을 확대 개편한다는 방침입니다.
5454,신입사원을 모집하는 직무는 운용 직군의 △해외FI운용 △ETF운용 △ETF상품개발 △솔루션전략 △글로벌비즈니스 마케팅 직군의 △ETF마케팅 △리테일마케팅 △연금마케팅 관리 직군의 △경영기획·경영관리 △IT △트레이딩·오퍼레이션 등이다.
5455,지원 희망자는 한국투자금융그룹 채용홈페이지에서 온라인 입사지원서를 제출하면 된다.
5456,해당 홈페이지에서 세부직무 및 필요역량 문의처 등 상세한 내용을 확인할 수 있다.
