,sentence
2687,즉 배터리 소재를 쉽고 저렴하게 확보하는 것이 전기차 사업의 경쟁력이 될 수 있는데 여기에서는 배터리 수거 역량이 핵심이고 기존 자동차 업체들의 넓은 정비망은 큰 도움이 된다.
2688,물론 자율주행으로 인한 자동차 공유의 시대가 본격화되고 디지털 가상 세계가 열려 사람들의 이동이 줄어들수록 자동차 수요는 감소하겠지만 관련 서비스를 통한 단위당 부가가치는 오히려 커질 수도 있다.
2689,그렇다면 지금 자동차 주가에 대한 큰 폭의 디스카운트는 어울리지 않을 수 있다.
2690,단 자동차 임대보다는 소유가 익숙한 한국·일본 업체들은 다소 불리할 수 있다.
2691,한편 ‘탈글로벌화’로 인해 소비 중심의 선진국들이 생산 위주의 신흥국에서 제조 설비를 가져오려는 움직임을 보인다.
2692,여기에는 공급망의 안정과 고용 확보라는 측면도 있지만 제조 업체를 통해 얻을 수 있는 데이터 및 귀한 자원들이 결부돼 있기 때문이다.
2693,사람이 디지털 가상공간에서 작업하면 실시간으로 현장에 반영되는 사물인터넷이 빠르게 보급될 수밖에 없다.
2694,‘굳이 그렇게 스마트하게 살 필요가 있나’라는 생각과 함께 지금까지는 초고속 통신망이라는 비싼 투자를 미뤄왔지만 이제는 그럴 이유가 생기고 있다.
2695,안정적인 투자처라는 기존의 이미지와 다르게 특정 테마에 묶여 급등과 급락이 반복되고 있어서다.
2696,삼성스팩이 다른 스팩에 비해 합병이 순조롭다고 하나 삼성그룹사와 합병을 하는 것은 아니다.
2697,증권가에서는 M&amp;A 소식이 있을 때 스팩의 주가가 오르지만 특별한 이유 없이 급등락을 반복하는 경우도 많아 투자에 유의해야 한다고 조언한다.
2698,몸집이 작은 데다 유통 물량이 많지 않아 작은 거래대금으로도 주가 변동성이 커질 수 있다.
2699,주가를 인위적으로 끌어올리려는 세력의 주요 타깃이 될 수 있다는 지적이다.
2700,이에 스팩의 규모가 클수록 오히려 합병에 성공할 가능성이 낮아진다는 분석이다.
2701,금융투자업계 관계자는 스팩은 합병 시 가액을 시가총액 기준으로 산정해 주가가 오를수록 합병되는 기업 주주의 지분율이 낮아진다며 주가가 폭등할수록 합병 가능성이 떨어지는 것이라고 설명했다.
2702,또 다른 관계자는 스팩은 아무런 사업을 하지 않아 주가가 큰 폭으로 변동되는 것은 논리적이지 않다면서 합병 대상을 찾지 못하고 청산하는 스팩이 발생할 수 있어 각별한 주의가 요구된다고 말했다.
2703,정희준 신한투자증권 실리콘밸리 사무소장 이영창신한투자증권 사장 윤상수 샌프란시스코 총영사 박용민 코트라 실리콘밸리무역관장(사진 왼쪽부터)이 신한투자증권 실리콘밸리 사무소 개소를 기념해 케이크를 자르고 있다.
2704,글로벌 최대 벤처 생태계인 실리콘밸리에서 신한투자증권은 현지 투자자·스타트업 기업들과 긴밀한 네트워크를 구축하게 된다.
2705,또 글로벌 최신 트렌드 분석과 함께 유망 스타트업을 발굴하고 투자 기회를 모색한다.
2706,현지 사무소는 특히 신한투자증권 본사의 전사적인 IB 역량과 신한금융그룹의 글로벌 네트워크를 바탕으로 국내와 해외를 잇는 글로벌 벤처 생태계 구축의 교두보 역할을 맡는다.
2707,신한투자증권은 뉴욕과 홍콩 베트남과 인도네시아에 현지 법인을 운영 중이다.
2708,이날 개소식에 참석한 이영창 신한투자증권 사장은 최근 글로벌 금융시장의 불확실성이 증가하고 있지만 세계 최고의 인재와 기술이 결집한 실리콘밸리는 혁신과 성장을 멈추지 않을 것이라며 신한투자증권 본사가 가지고 있는 투자 역량 및 IB 전문성과 결합해 실리콘밸리에 미래를 위한 투자의 씨앗을 심을 것이라고 밝혔다.
2709,한편 이날 행사에는 KOTRA KDB KIC 등 현지에 진출한 한국계 투자기관 기관장들과 명망 있는 한국계 및 벤처 캐피탈 전문가들이 함께 모여 사무소 개소를 축하하고 신한투자증권과 함께 벤처 생태계 확장을 위한 기회를 모색키로 했다.
2710,독일 정부가 함부르크의 톨러오르트 터미널에 대한 중국 국영 해운사 중국원양해운(COSCO·코스코)의 지분 참여 계획을 허용하기로 한 것으로 알려졌다.
2711,사진 영상 제보받습니다 공감언론 뉴시스가 독자 여러분의 소중한 제보를 기다립니다.
2712,회복되는 수요에도 대응할 필요성…올해 캐펙스는 증가 전망삼성전자가 반도체 업황이 악화된 상황이지만 인위적 감산을 하지 않겠다는 입장엔 변화가 없다고 밝혔다.
2713,한진만 부사장은 중장기 수요 대응을 위한 인프라 투자는 지속된다며 올해 평택 공장에 대규모 인프라 투자가 진행되면서 시설투자(캐펙스)는 원화 대비는 증가하지만 달러 대비는 감소할 수 있다고 말했다.
2714,다만 디지털 헬스케어 신사업을 위한 인건비 지급수수료 등 고정비와 일회성 비용 증가의 영향으로 영업이익은 다소 감소했다고 부연했다.
2715,산은 관계자는 팹리스에서 디자인하우스까지 반도체 밸류체인 내 기술기반 스타트업에 대한 전방위적 지원을 해왔다며 국내 반도체 산업의 초격차를 이끌 수 있는 혁신 유망기업을 지속 발굴하고 금융지원을 통해 기술패권 경쟁 선도와 초저성장 극복에 기여할 예정이라고 말했다.
2716,LCD TV부문의 국내 생산 종료를 앞당기고 유기발광다이오드(OLED)와 하이엔드 LCD 중심으로 사업을 재편해 업황 개선에 힘쓰겠다는 전략을 내놨다.
2717,이같은 어닝쇼크의 원인으로는 올해 이어지는 구매 수요 급감 및 패널가격 하락이 꼽힌다.
2718,특히 세트업체들의 강도 높은 재고 감축 등 영향으로 패널 수요가 예상 대비 큰 폭으로 감소하며 중형 및 프리미엄 TV용 패널에 악재로 작용했다.
2719,LCD 패널 가격 역시 예상보다 하회하는 수준으로 하락해 실적에 영향을 미쳤다.
2720,또 글로벌 경제침체와 러시아-우크라이나 전쟁 장기화로 재무건전성에 빨간불이 켜졌다.
2721,이때문에 LG디스플레이는 재무건전성을 강화하기 위해 LCD 출구 전략을 가속화하겠다는 전략을 내놨다.
2722,LG디스플레이 관계자는 “투자 및 운영 비용 최소화를 통해 재무 건전성 회복을 최우선 과제로 실행하겠다고 강조했다.
2723,LG디스플레이는 수요 부진 장기화에 대응해 OLED 및 하이엔드 LCD와 수주형 사업을 중심으로 사업구조 재편을 가속화하겠다는 계획을 밝혔다.
2724,이를 바탕으로 대형 사업 부문에서는 질적 성장을 추진 제품 고도화 및 운영 효율화를 통해 수익성 확보의 기반을 마련한다.
2725,중형 사업 부문에서는 하이엔드 LCD 제품을 중심으로 차별화 경쟁력 강화를 통해 사업의 변동성을 줄여갈 계획이다.
2726,태블릿 PC와 WOLED 기반 모니터 등 중형 OLED 시장을 선점하고 기술 리더십을 강화하기 위한 준비도 지속해 나갈 계획이다.
2727,소형 및 자동차용 사업 부문에서는 스마트폰 신모델 공급을 시작했으며 향후 하이엔드 제품을 중심으로 사업 역량을 강화해 나갈 계획이다.
2728,차별화된 라인업과 솔루션을 바탕으로 지속 성장하고 있는 스마트워치 및 차량용(Auto) 디스플레이 시장에서 격차를 확대하며 위상을 더욱 강화할 계획이다.
2729,에어리퀴드 마리타임과 에어리퀴드솔루션즈코리아는 프랑스 에어리퀴드의 자회사다.
2730,김 지사는 “산업 및 의료용 가스 분야 세계적 기업인 에어리퀴드사의 투자 결정을 환영한다며 “신규 공장이 신축돼 정상 가동할 때까지 적극 지원하겠다고 밝혔다.
2731,물가연동 채권 I 본드는 안정적인 상품이지만 인기 있는 상품은 아니라고 WSJ는 전했다.
2732,CNN은 현금유동성에는 좋은 투자가 아니지만 최근의 높은 인플레이션 환경을 감안하면 당장필요하지 않은 현금을 투자하기에는 좋은 상품이라고 설명했다.
2733,왼쪽부터 신한투자증권 정희준 실리콘밸리 사무소장 신한투자증권 이영창 사장 윤상수 샌프란시스코 총영사 박용민 코트라 실리콘밸리무역관장이 신한투자증권 실리콘밸리 사무소 개소를 기념해 케이크를 커팅하고 있다.
2734,실리콘밸리에서 신한투자증권은 현지 투자자 및 스타트업 기업들과 긴밀한 네트워크를 구축하고 글로벌 최신 트렌드 분석과 함께 유망 스타트업 발굴 및 투자 기회를 모색하게 된다.
2735,현지 사무소는 특히 신한투자증권 본사의 전사적인 IB 역량 및 신한금융그룹의 글로벌 네트워크를 바탕으로 국내와 해외를 잇는 글로벌 벤처 생태계 구축의 교두보 역할을 맡게 된다.
2736,신한투자증권은 뉴욕과 홍콩 베트남과 인도네시아에 현지 법인을 운영 중이며 중국에 상해 사무소를 두고 있다.
2737,이날 개소식에 참석한 이영창 신한투자증권 사장은 “최근 글로벌 금융시장의 불확실성이 증가하고 있지만 세계 최고의 인재와 기술이 결집한 실리콘밸리는 혁신과 성장을 멈추지 않을 것이라며 “신한투자증권 본사가 가지고 있는 투자 역량 및 IB 전문성과 결합해 실리콘밸리에 미래를 위한 투자의 씨앗을 심을 것이라고 말했다.
2738,서울뉴시스 돌싱포맨 멤버들이 검진의 날을 맞아 황현희 홍성우 최유나를 만났다.
2739,com *재판매 및 DB 금지서울뉴시스최윤정 인턴 기자 돌싱포맨 검진의 날을 맞아 돈 건강 사랑 전문가들이 출격한다.
2740,이날 방송에서 투자 전문가가 된 황현희 출연에 멤버들은 제일 많이 번 게 얼마냐 지금이 주식을 살 때냐며 폭풍 질문을 쏟아낸다.
2741,비뇨의학과 전문의 겸 크리에이터 꽈추형으로 활동 중인 홍성우는 관상만으로 남성 활력 순위를 알 수 있다며 돌싱포맨 활력 순위를 공개한다.
2742,요속과 활력의 관계 등 남성 건강 속설에 대한 진실을 파헤치며 현장 열기를 더했다는 후문이다.
2743,최 변호사는 이혼 소송 시 위자료 재산 분할 등 이혼의 다양한 기술을 전하며 이목을 끌었다.
2744,이어 변호사 생활 중 황당했던 이혼 사유를 밝혀 멤버들을 충격에 빠트린다.
2745,군은 해조류를 특화한 해양바이오산업을 중점 육성하고 있는 가운데 해양치유와 연계된 산업 벨트를 구축하고 있어 이번 투자 유치가 성사됐다.
2746,시설이 건립되면 미세조류를 활용한 ‘클로로필 a’라는 기능성 소재를 주로 생산하며 ‘클로로필 a’는 면역력 증진 항암 작용 혈액 개선 등에 효과가 있다.
2747,신우철 완도군수는 “해양바이오산업 활성화를 위해 솔로몬바이오의 투자 사업에 적극적으로 협조하겠다면서 “신지면을 중심으로 한 해양바이오 단지를 완성해 바이오 기업 유치로 고용 창출 및 지역 경제가 활성화될 수 있도록 최선을 다하겠다고 전했다.
2748,한편 이번에 개최된 투자 유치 설명회는 전남도의 풍부한 천연 생물자원을 기반으로 한 바이오산업 환경 등 강점을 홍보하고 우수 벤처·창업 기업 투자 활성화를 위해 마련됐다.
2749,SK하이닉스는 글로벌 인플레이션 장기화와 미국 등 주요 국가의 금리 인상 등으로 거시경제 환경이 악화하는 가운데 반도체 D램과 낸드 제품 수요가 부진해 판매량과 가격이 모두 하락하며 매출이 크게 감소했다고 판단했다.
2750,회사 측은 이날 실적발표를 통해 경영환경의 불확실성이 지속되면서 메모리반도체 산업이 전례 없는 시황 악화 상황에 직면했다고 진단했다.
2751,메모리 주요 공급처인 PC 스마트폰을 생산하는 기업들의 출하량이 감소했기 때문이다.
2752,다만 데이터센터 서버에 들어가는 메모리 수요는 단기적으로 감소하겠지만 중장기적으로는 꾸준히 성장세를 탈 것으로 내다봤다.
2753,AI 빅데이터 메타버스 등 새로운 산업의 규모가 커지면서 대형 데이터센터 업체(Hyperscaler)들이 이 분야 투자를 지속하고 있기 때문이다.
2754,상대적으로 수익성이 낮은 제품을 중심으로 생산량을 줄여 나갈 계획도 밝혔다.
2755,성남FC 후원금 의혹에 연루된 정 실장은 조만간 소환조사를 받을 전망이다.
2756,불법 정치자금 수수 의혹과 관련해 자금 용처 등을 확인하는 검찰은 김 부원장의 재산 형성 과정 조사도 수사의 한 줄기로 보고 있다.
2757,검찰은 정 실장이 사실상 이 대표를 대신해 구단주 역할을 하며 불법 후원금 유치를 도맡았다고 보고 있다.
2758,최근 접대 장소로 의심되는 유흥주점 관계자들을 조사하고 관련 진술·증언을 확보하는 등 혐의 다지기에 한창인 것으로 전해졌다.
2759,그는 입장문을 내고 불법 자금을 받았다는 건 일고의 가치도 없는 허구 그 자체라며 검찰이 소환하면 언제든지 당당하게 응해 성실하게 조사받을 것이라고 말했다.
2760,경제범죄수사대장(피해자들이) 본전 생각이 나서 신고를 못하고 주변에 지인들을 유인하는 이렇게 회원을 가입시키는 구조다보니까 신고를 못하고 피해가 계속.
2761,경찰은 해외에 체류하며 이번 범행에 가담한 유명 사업가에 대해 인터폴에 공조 수사를 요청하고 비슷한 피해가 발생하지 않도록 각별한 주의를 당부했습니다.
2762,이 장관의 요청에 추 부총리는 “재정건정성이 흔들리지 않는 범위에서 아낌없이 지원하겠다며 “세제 지원을 보강하겠다고 호응했다.
2763,이에 윤 대통령은 기재부와 금융위원회와 함께 다른 부처에도 애로사항을 전하라면서 “중기부 장관도 기재부에 강력하게 요청해 세제지원을 대폭 이끌어내라고 말했다.
2764,이와 함께 이정식 고용노동부 장관은 이날 회의에서 구인·구직 간 미스매치 해소에 주력하겠다고 밝혔다.
2765,이 장관은 특히 “노동자들의 건강이 훼손되지 않도록 하고 재해예방을 더 하도록 하겠다고 강조했다.
2766,다만 D램과 낸드플래시 등 메모리반도체 불황이 내년 하반기까지 계속될 것이라는 우려와 함께 미국의 중국 장비 수출 통제 리스크도 남아 있어 향후 시장 전망이 밝지만은 않다.
2767,고물가·고금리 현상이 장기화하는 가운데 PC·스마트폰 제조업체들의 메모리 수요가 급감한 것이 주요 원인으로 분석됐다.
2768,SK하이닉스는 D램과 낸드플래시 제품 수요가 부진해지면서 판매량이 줄고 가격도 하락하며 전분기 대비 매출이 감소했다고 밝혔다.
2769,SK하이닉스는 공급이 수요를 초과하는 상황이 당분간 지속할 것이라며 내년 투자 규모와 메모리 생산량을 줄이겠다는 결단을 내놨다.
2770,노종원 사장은 이어 “올해 말 업계 재고규모가 매우 높은 수준으로 예상되는 만큼 웨이퍼 캐파(CAPA·생산능력) 투자를 최소화하고 공정전환 투자도 일부 지연시킬 계획이라며 “이 과정에서 내년 D램과 낸드의 웨이퍼 생산량은 올해 대비 줄어들고 선단공정 비중도 당초 계획보다 낮아질 계획이라고 부연했다.
2771,일정기간 동안 투자 축소와 감산(減産) 기조를 유지함으로써 시장의 수급 밸런스를 정상화하겠다는 것이다.
2772,(자료SK하이닉스)“서버용 고부가제품으로 수익개선…美 장비 규제는 과제투자 축소 및 감산 결정에도 내년 전망을 밝게 내다보진 못했다.
2773,노 사장은 이어 “내년 하반기 정도에는 시장 안정화를 기대하지만 거시경제 불확실성 등이 해결되지 않으면 다운턴(불황)이 길어질 가능성도 배제할 수 없다며 “생산 캐파를 축소하는 건 메모리 사업자 입장에서 고통스럽다고도 했다.
2774,다만 데이터센터 서버에 들어가는 메모리 수요는 중장기적으로는 꾸준히 성장세를 탈 것으로 전망되는 만큼 서버용 메모리 등 고부가가치 제품을 확대해 수익성을 개선하겠다는 전략도 내놨다.
2775,인공지능(AI)·빅데이터·메타버스 등 새로운 산업의 규모가 커지면서 대형 데이터센터 업체들은 투자를 지속하는 상황이다.
2776,한편 SK하이닉스는 중국에서도 메모리 사업을 하고 있어 미국의 대 중국 반도체 장비 수출 규제 대상이다.
2777,노 사장은 이와 관련 “정치적 이슈들이 비즈니스 의사결정에 많은 영향을 주고 있다며 “극자외선(EUV) 노광장비의 경우 조심스럽지만 현재 상황으로선 중국 우시에 있는 D램 팹(공장)에 들어가는 것은 어려울 것 같다고 말했다.
2778,다만 단기적인 관점에서 중국 외 생산거점을 다변화하는 것이 쉽지 않다고도 답했다.
2779,SK하이닉스 제공 SK하이닉스가 시장 기대치를 크게 밑도는 실적을 내면서 내년 투자를 올해보다 대폭 줄인다고 밝혔다.
2780,회사는 전 세계적으로 거시경제 환경이 악화하는 상황에서 D램과 낸드 제품 수요가 낮아지며 판매량·가격이 모두 하락한 것을 부진의 원인으로 꼽았다.
2781,메모리 반도체 산업이 전례 없는 시황 악화 상황에 직면했다고 진단하기도 했다.
2782,메모리 주요 공급처인 PC와 스마트폰을 생산하는 기업들의 출하량이 감소했기 때문이다.
2783,그러면서도 데이터센터 서버에 들어가는 메모리 수요는 단기적으로 감소하겠지만 중장기적으로는 꾸준히 성장세를 탈 것으로 내다봤다.
2784,SK하이닉스는 공급이 수요를 초과하는 상황이 당분간 계속될 것으로 내다봤다.
2785,일정 기간 이처럼 투자 축소와 감산 기조를 유지해 시장의 수급 밸런스를 정상화한다.
2786,김수영 브랜드홍보본부장은 앞으로도 새로운 사명으로 출범한 신한투자증권의 고객 만족 의지가 어우러진 다양한 이벤트를 통해 누구나 편하게 접할 수 있는 브랜드로 고객과 소통하겠다고 밝혔다.
2787,김 부원장측은 저축한 돈과 부인이 은행에서 받은 신용대출로 충당했다는 입장이지만 검찰은 김 부원장이 대장동팀에서 받은 또 다른 자금이거나 다른 곳에서 받은 불법 자금일 가능성을 열어 놓고 자금 흐름 전반을 추적하고 있습니다.
2788,SK하이닉스는 전세계적인 거시경제 환경 악화 속에 D램·낸드플래시 등 메모리 반도체 수요가 부진해진 영향이 크다고 평가했다.
2789,최근 글로벌 반도체 업계는 대외 불확실성이 지속되면서 전례 없는 메모리 시황 악화에 직면했다.
2790,메모리 주요 공급처인 PC 스마트폰을 생산하는 기업들의 출하량이 감소했기 때문이다.
2791,회사는 메모리 시장이 내년 하반기에 회복할 것으로 전망하면서도 대외 불확실성으로 가격 하락세가 더 이어질 수도 있다고 조심스럽게 내다봤다.
2792,이어 “올해 말 예상되는 업계의 재고 규모가 매우 높은 수준으로 예상되는 만큼 회사는 생산 증가를 위한 웨이퍼 설비투자를 최소화하고 공정전환 투자도 일부 지연할 예정이라고 전했다.
2793,SK하이닉스는 프리미엄 제품군 개발을 통해 시장 수요를 끌어올리겠단 계획이다.
2794,데이터센터 서버에 들어가는 메모리 수요는 중장기적으로는 꾸준히 성장세를 탈 것으로 전망되기 때문이다.
2795,인공지능(AI) 빅데이터 메타버스 등 새로운 산업의 규모가 커지면서 대형 데이터센터 업체들이 이 분야 투자를 지속하고 있다.
2796,이와 관련 SK하이닉스는 중장기적으로 생산거점 다변화를 고려하면서도 단기적으로 생산 일정에 변화를 주긴 어렵다고 전했다.
2797,노 사장은 “SK하이닉스의 위상이 과거 그 어느 때 보다 달라진만큼 안정적인 반도체 생태계 유지를 위해 노력하며 글로벌 반도체 업계 리더로서의 역할을 다하겠다고 말했다.
2798,경기 불확실성이 지속될 것이라는 위기감이 엄습하면서 이들 기업은 투자 축소와 동시에 감산 카드까지 꺼내 들었다.
2799,한국 경제의 버팀목 역할을 해온 대기업들의 실적이 줄줄이 추락한 것은 경기 침체 영향이 크다.
2800,글로벌 수요가 급속히 위축되면서 반도체 부문에서는 D램과 낸드플래시 제품의 판매량이 줄어들고 가격도 크게 떨어졌다.
2801,디스플레이 부문에서는 액정표시장치(LCD) 패널 가격이 역사상 최저 수준이 됐다.
2802,노 사장은 올해 말 반도체 재고가 매우 높은 수준으로 예상되는 만큼 생산을 늘리기 위한 투자는 최소화할 계획이라고 했다.
2803,치킨게임을 지속하던 글로벌 반도체 시장은 독일 키몬다 일본 엘피다의 파산 이후에야 바닥을 치고 회복세로 돌아섰다.
2804,LCD TV의 국내 생산 종료 계획을 앞당기고 중국 생산도 단계적으로 축소하기로 했다.
2805,최근 위메이드는 게임사를 넘어 블록체인 게임 블록체인 게임 플랫폼 디지털 이코노미 플랫폼을 제공하는 회사로 진화하는 사업을 전개하고 있다.
2806,이런 과도기에서 블록체인 인력을 보강함에 따라 인건비가 증가한 것으로 나타났다.
2807,다양한 게임 토큰 대체불가토큰(NFT) 디파이(DeFi) 등 모든 거래에 사용된다.
2808,장 대표는 디지털 블록체인 이코노미가 발전하려면 스테이블 코인은 필수적이다.
2809,위믹스 달러의 성장은 위믹스 코인과 위믹스 생태계의 성장으로 선순환을 이루게 될 것이라고 자신했다.
2810,어떠한 외부적인 위기 속에서도 회사와 그 활동이 지속 가능할 수 있도록 관리해 나가겠다며 위믹스가 명실상부 글로벌 디지털 이코노미 플랫폼이 될 수 있도록 최선을 다하겠다고 말했다.
2811,또한 기술적 고도화를 통해 NFT와 DAO(탈중앙화 자율조직)를 결합한 신 경제 플랫폼 나일(NILE)도 공개 예정이다.
2812,장 대표는 게임에 토크노믹스가 붙으면 더 재밌어지고 유저 베이스가 커져 게임사 매출도 늘어나게 된다.
2813,이를 기술적으로 이뤄주는 게 위믹스 플랫폼이라면서 현 시점에서 어떤 게임사가 자사 게임에 블록체인을 붙이고 토큰과 토크노믹스를 만들고 싶다고 했을 때 이를 유일하게 완성해주는 회사가 위메이드이고 위믹스 플랫폼이라고 자평했다.
2814,또 장 대표는 아부다비에 지사를 설립하고 있다며 중동 지역에서 우리 회사나 위믹스에 투자하는 곳도 있고 센터를 만들기도 하는 등 다각도로 협업을 진행하고 있다고 전했다.
2815,이 사건은 A씨가 잠적한 후 매월 수백만원에 달하는 차량 할부금을 고스란히 떠안게 된 피해자들이 A씨를 고소하면서 불거졌다.
2816,조사 결과 A씨는 이 보증금으로 피해자들의 렌트 비용을 납부하는 이른바 돌려막기 방식으로 범행한 것으로 파악됐다.
2817,재판부는 피고인은 수년간 많은 피해자를 상대로 돌려막기식 사기 범행을 이어왔고 실제 피해 금액은 더 많을 것으로 보인다며 누범기간에 저지른 범행이어서 무겁게 처벌할 필요가 있다고 설명했다.
2818,그러면서 피고인이 피해자들의 월 할부금을 일부 납부했고 피해자들 일부가 처벌불원서를 제출했으나 양형기준의 권고형 등을 참작해 형을 정했다고 판시했다.
2819,휴대용 질소 커피 개발 업체 수주 물량 못 맞춰투자 유치 어려워 사업 중단·축소하는 업체도수산물 당일 배송 서비스 업체 전 직원 권고사직스타트업계 민간 주도 투자 활성화 필요앵커최근 경기 침체와 가파른 금리 인상으로 투자 심리가 위축되면서 스타트업계가 심각한 자금난을 겪고 있습니다.
2820,자금 유동성이 풍부했던 때와 과거와 달리 투자 혹한기가 몰아치면서 축제는 끝났다는 평가가 나오고 있습니다.
2821,기자주사기처럼 생긴 캡슐을 누르면 신선한 콜드 브루 커피 한 잔이 만들어집니다.
2822,이정오 / 스타트업 대표 : 국내 투자자들은 아무래도 과거의 실적과 매출을 기준으로 투자하다 보니까….
