,sentence
8010,그는 아동노동법 위반 사실이 드러난 현대차 부품 공급사들과 관계를 단절할 계획이라고 말했다.
8011,SOC는 이어 아동 노동과 열악한 직장 보건·안전은 미국 내 현대차에 규제 및 법적 영향을 주고 평판을 훼손할 수 있다며 현대차 이사회가 이 문제에 대한 대응을 감독하고 공급망 전반에 대해 인권·노동권 실태를 점검하라고 촉구했다.
8012,아동노동법 위반 드러난 현대차 자회사 스마트 앨라배마앨라배마 로이터연합뉴스 자료사진.
8013,호세 무뇨스 현대차 글로벌 COO는 이날 로이터에 미국 내 전체 부품 공급사에 대해 아동노동법 위반 가능성에 대한 점검을 지시했다며 미성년자 노동 사실이 드러난 앨라배마의 협력사들과는 관계를 단절하기로 했다고 말했다.
8014,머스크의 트위터 인수가 성사되지 못하더라도 대규모 인력 감축이 예상된다고 WP는 적었다.
8015,애초 트위터 경영진은 직원들에게 즉각적인 해고 계획이 없다고 여러 차례 밝혀왔다.
8016,WP는 지난 몇 달 간의 상황을 반영하는 새로운 세부사항을 보면 머스크가 계획한 트위터 혁신 작업의 극단적인 성격이 부각한다고 했다.
8017,또 측근들에게 트위터 규모를 극적으로 줄이는 게 효율적인 직원과 수익성 있는 혁신을 불러오는 첫 단계라고 생각한다고 말했다.
8018,직원의 사기를 저하시키는 인력감축이라는 고통스러운 발표를 경영진이 피하는 데 도움이 된다는 것이다.
8019,트위터에 몸담았다 현재 콘텐츠 조정 스타트업인 서지AI의 CEO를 맡고 있는 에드윈 첸은 “그런 해고의 영향은 수백만명의 트위터 사용자가 즉시 느낄 수 있다면서 “트위터에 직원이 너무 많다고 생각하지만 머스크가 제안한 감축은 상상할 수 없는 것이라고 했다.
8020,그러면서 트위터 사용자를 해킹과 아동 포르노 등 공격적인 자료에 노출시킬 위험에 놓이게 한다고 주장했다.
8021,웨드부시증권의 댄 이브스 애널리스트는 “머스크에게 쉬운 건 트위터를 사는 것이고 어려운 부분은 회사를 고치는것이다.
8022,기업 지배구조 전문가인 넬 미노우 밸류엣지자문의 부회장은 “그(머스크)가 인력 감축을 한다면 뭔가를 보여줄 수 있어야 한다.
8023,CDU·VDU는 원유를 끓여 휘발유나 경유 등 석유제품을 생산하는 설비다.
8024,업종별 하향 이유에 대한 조사 결과 대부분의 업종에서 환율 및 원자재가격 급등으로 생산비용 증가가 가장 높은 응답률을 보였다.
8025,특히 원자재 가격 상승은 고환율 기조가 더해지면서 기업들은 더욱 팍팍한 경영환경에 놓였다.
8026,수출기업이 많은 국내 산업계에서는 환율 상승 시 우리 수출품의 가격 경쟁력이 높아지고 원화 표시 매출액이 늘어난다는 것이 통념이었지만 원자재 가격 급등에 따른 수익성 악화가 환율 수혜를 상쇄하거나 혹은 이익 훼손에 까지 이른다는 것이다.
8027,장근혁·백인석 자본시장연구원 선임연구위원은 보고서에서 우리나라를 비롯해 주요국 물가 상승세가 확대되며 경제주체의 어려움이 가중되고 있다며 이번 인플레이션은 원자재 가격 상승 공급망 차질 등 글로벌 요인이 주요 동인으로 지목된다며 우리나라는 미국과 달리 수요압력이 물가에 유의미한 영향을 미치지 않고 있다.
8028,이는 국내 소비가 아직 구조적 부진에서 완전히 벗어나지 못한 데 기인한다고 분석했다.
8029,ICT 네트워킹데이 주요 프로그램은 ▲대구경북경제자유구역청 인센티브 소개 ▲수도권에서 지역으로 이전하는 ICT기업의 이전사례 발표(주식회사 베이리스 김형준 대표) ▲지역정착 성공사례 발표(우경정보기술 박윤하 대표) ▲AI산업 트렌드를 살펴보는 전문가 강연(카이스트 심현정 교수) 등 기업에 실질적으로 도움이 될 수 있는 사례발표와 정부 등 AI산업의 정책동향을 동시에 알수 있도록 구성했다.
8030,자유구역청은 수도권 ICT기업을 수성알파시티 등 지역 내 경제자유구역으로 중점 유치할 수 있는 기초를 마련하고 아울러 지역 내 ICT 클러스터의 확장은 물론 내실까지 챙길 계획이다.
8031,성남시 판교에 있는 ㈜베이리스와 서울 서초구에 있는 ㈜비즈데이터와 같은 수도권 유망테크기업들이 잇따라 지역으로 이전을 결정하면서 ICT와 ABB산업 관련 기업들이 사업영역을 급속히 넓혀가고 있다.
8032,자유구역청은 내심 이러한 분위기를 적극 활용해 지역을 대구의 실리콘밸리 지역의 디지털 혁신거점으로 거듭나게 하겠다는 각오다.
8033,대구경북경제자유구역청 최삼룡 청장은 “수도권에 소재한 ICT기업들을 처음으로 한자리에 모았다는 점만으로도 큰 의미를 가진다.
8034,최근 ICT와 ABB 산업으로 급부상하고 있는 수성알파시티 등 대구경북 경제자유구역에 수도권 기업들의 투자유치를 활성화시켜서 SW융합산업의 영남권 디지털혁신 중심거점으로 성장시킬 수 있도록 지원과 노력을 아끼지 않겠다고 밝혔다.
8035,이경민 대신증권 투자전략팀장이 물가와 통화정책 경기 간의 악순환 고리에 빠진 국내증시를 진단하고 리스크 관리에 중점을 둔 약세장 투자전략을 소개할 예정이다.
8036,세미나에 참여하려면 대신증권의 온라인 거래매체 사이보스 및 크레온(HTS MTS) 또는 홈페이지에서 사전신청을 하면 된다.
8037,정경엽 대신증권 디지털마케팅부장은 급등락을 반복하며 하락추세를 보이는 국내증시에 대한 대응전략 문의가 많아지고 있다며 이번 세미나가 투자자들의 궁금증을 해소하고 대응전략을 세우는데 도움이 되길 바란다고 말했다.
8038,천연가스 가격 하락과 함께 독일 및 프랑스 전력가격도 하락세를 보이는 등 겨울철 에너지 대란 리스크가 진정되는 분위기다.
8039,박 연구원은 유럽 내 천연가스 가격이 급락하는 배경에는 일단 예상보다 양호한 독일 등 유럽 내 천연가스 비축량을 들 수 있다고 설명했다.
8040,그는 “천연가스 가격 하락으로 유로화는 재차 패리티 수준을 회복했고 폭등세를 보이던 유럽 생산자물가와 소비자물가 상승률 역시 둔화될 가능성이 커졌다며 “동시에 나락으로 떨어졌던 각종 심리지표들이 반등할 수 있는 모멘텀 역할을 할 공산이 높아졌다고 판단했다.
8041,또 날씨라는 돌발 변수도 잠재해 있어 유럽이 겨울철 에너지 대란에서 벗어난다고 단정짓기 어렵다는 설명이다.
8042,박 연구원은 “그럼에도 불구하고 우려와 달리 유럽 천연가스 가격의 하향 안정 추세는 유럽 경제 및 금융시장 더 나아가 글로벌 경제와 금융시장에 긍정적 신호라며 “더욱이 물가 압력도 빠르게 둔화될 수 있는 요인을 제공하고 있다는 측면에서 유럽 천연가스 가격 추이는 일단 긍정적으로 평가된다고 밝혔다.
8043,파이낸셜뉴스 홍성김원준 기자 충남도와 홍성·예산군이 충남도청 신도시이자 충남혁신도시인 내포신도시의 상권 활성화를 위해 공동 대응에 나섰다.
8044,이에 앞서 충남도와 양군은 올해 내포신도시 정주여건 개선을 위한 대책 마련 실무협의를 수 차례 추진하고 상권 활성화 등에 공동으로 대응해 나가기로 뜻을 모았다.
8045,박람회에서는 투자 상담은 물론 프랜차이즈 본사를 대상으로 내포신도시 투자 제안 및 홍보영상 송출 홍보물 배포 등 내포신도시가 투자를 위한 최적지임을 알릴 예정이다.
8046,충남도 관계자는 “도와 홍성·예산군은 내포신도시 상권 활성화를 위해 지속적인 협력해 나아갈 것이라며 “정주 여건 개선을 통해 행정중심복합도시로서의 면모를 갖추도록 최선을 다하겠다고 말했다.
8047,이들 가운데 김혜수는 저축·투자 부문에서 대통령 표창을 박보검은 국무총리 표창을 차승원은 금융위원장 표창을 각각 받았다.
8048,박보검 역시 모범적인 저축 생활과 함께 장애 어린이 재활 치료비 후원 ‘희망의 집짓기’ 봉사 등 다양한 후원 활동을 해왔다.
8049,김 위원장은 이날 축사에서 “우리 경제성장의 핵심이었던 저축의 의미와 정신은 살리는 가운데 금융의 포용성과 혁신성에 대한 인식 제고를 위해 금융의 날에는 저축·투자 포용금융 혁신금융에 기여하신 분들에게 포상을 수여하고 있다고 설명했다.
8050,금융의 날은 금융에 대한 국민 관심을 높이고 종사자들을 격려하기 위한 법정 기념일이다.
8051,사진REUTERS뱅크 오브 아메리카(BofA)는 이번주에 실적을 발표하는 메타(META) 의 투자 등급을 ‘중립’으로 강등하며 투자자들이 주식 사는 것을 보류하기를 권했다.
8052,그는 또 메타의 사용자들이 메타가 틱톡 대항으로 내놓은 동영상 프로그램 릴스로 성공적으로 전환되고 있는지도 확신할 수 없다고 밝혔다.
8053,주가 하락이 지속되니 개인투자자들의 손실이 이어지고 있다는 보도가 자주 나옵니다.
8054,개인투자자들의 가장 큰 장점은 다른 어떤 투자자와 비교해도 장기 투자가 가능하다는 것입니다.
8055,좋은 기업을 선택했다면 지금의 평가손실에도 불구하고 이익을 실현할 가능성이 높습니다.
8056,단기 주가 전망을 하기 어렵기 때문에 경쟁력 있는 기업을 선택하는 것경기나 주가의 움직임을 예측하실 수 있으신가요?
8057,주식시장의 전문가들은 이런 것들을 예측해서 다른 사람보다 더 좋은 성과를 얻으려고 합니다.
8058,좀 길게 보고 어느 정도의 투자 수익을 얻었으면 좋겠다 정도의 목표를 가지고 그에 맞는 투자를 하면 됩니다.
8059,전문가들이라고 하는 투자 업계에 종사하는 사람들은 매일매일 넘쳐나는 자료와 정보에 둘러싸여 있습니다.
8060,업계를 떠나 개인적으로 투자를 하다 보니 접할 수 있는 정보의 차이가 확연히 느껴집니다.
8061,증권사 리서치에 앉아 있으면 본인이 담당하지 않는 산업이나 종목에 관한 이야기도 많이 들리고 관련해서 규제를 정치권의 동향 여론을 형성하는 사회단체들의 활동 등에 대해서도 많이 듣게 됩니다.
8062,그 중에는 제가 담당하는 산업이나 기업에 영향을 미칠만한 내용이 있을 때도 있습니다.
8063,그러면 관련 이슈가 앞으로 어떻게 전개될지를 한번 생각해 보고 나타나는 상황에 따라 대응은 어떻게 할지도 생각해 봅니다.
8064,그런데 지금은 뉴스를 보지 않으면 세상이 어떻게 돌아가는지를 알 수가 없습니다.
8065,접하는 정보의 차이가 나타나는 이유를 애널리스트가 보고서를 쓰는 과정을 통해서 한번 생각해 볼까요?
8066,이슈화되고 있는 내용을 분석하는 보고서라면 자료를 조사하고 판단을 하고 보고서를 쓰겠죠.
8067,결국 보고서가 나올 때쯤이면 특별한 경우를 제외하고 대부분은 어느 정도의 사람들은 해당 내용에 대해 알고 있었을 겁니다.
8068,여기서 오해하지 마셔야 할 것은 보고서 내용을 다른 사람들이 알고 있다는 것이 보고서 내용을 기관투자자들에게 먼저 알려준다는 의미가 아니라는 것입니다.
8069,그냥 많은 정보들은 그렇게 공유되고 있고 그에 따라 이미 펀드매니저들은 보고서와 관계없이 의사결정을 끝냈을 겁니다.
8070,애널리스트는 그렇게 공유된 정보들 중에서 더 중요하다고 생각되는 것을 논리적으로 평가해서 기업에 의미 있게 영향을 미칠 만한 내용들을 보고서에 담습니다.
8071,개인투자자가 애널리스트들의 보고서를 가지고 단기적인 투자의사결정을 하는 것이 좋은 선택이 아닌 이유입니다.
8072,개인투자자들이 접하는 정보의 대부분은 이런 과정을 거친 것일 가능성이 높습니다.
8073,그래서 특정 정보를 기초로 매매를 하는 것보다 긴 시간을 투자할 수 있는 기업을 선택하고 투자를 하는 것이 적절해 보입니다.
8074,애널리스트의 보고서와 같은 정보들은 장기 투자를 하는 기업을 선택할 때 경쟁력을 판단하는 참고자료로 활용해야 합니다.
8075,잘 정리된 애널리스트 보고서는 산업과 기업을 이해하기에 매우 좋은 자료입니다.
8076,그렇다고 좋은 기업이 없는 것은 아니죠저는 크리블앱을 실행시키면 나오는 투자명언들을 꼭 읽고 넘어갑니다.
8077,얼마 전 ‘좋은 기업의 주가는 결국 상승한다’는 워런 버핏의 좋아하는 문구도 하나 봤습니다.
8078,그런데 ‘좋은 기업’을 ‘경기와 무관하게 성장하는 회사’라고 잘못 이해하는 경우가 있습니다.
8079,대부분의 기업이 경기에 영향을 받기 때문에 경기가 좋으면 모든 기업이 다 좋아 보이죠.
8080,경기 부진이 시작된 지금 기업의 실적은 당초 기대치 대비로는 다 안 좋을 것 같습니다.
8081,전년도보다 실적이 좋아진 기업도 원래 예상했던 것보다는 좋지 않은 경우가 분명히 있을 겁니다.
8082,그 때문에 주가는 이미 하락을 했을 것이고 어쩌면 안 좋은 실적이 나오면서 더 하락할 수도 있겠네요.
8083,최근 증시가 소폭 반등하자 개인투자자들은 물려 있던 주식을 서둘러 팔아치우고 고금리 은행 상품으로 갈아타고 있다.
8084,오랜 기간 주식에 물려 지친 개인들이 반등 종목 중심으로 손절매에 나섰다는 분석이다.
8085,역실적 장세(기업 실적 하락으로 인한 증시 하락)가 나타나는 상황을 배제할 수 없는 분위기다.
8086,정명지 삼성증권 투자정보팀장은 “상승장이 온다는 확신이 들기 전까지는 증시를 이탈하는 자금이 늘어날 것이라고 말했다.
8087,국내 최초로 개인형 퇴직연금 계좌에 수수료 제로(단 펀드 보수 등 별도 발생)를 도입한 것과 고금리 시대에 절세 매력을 갖춘 점이 투자자들을 끌어당겼다.
8088,다이렉트IRP는 가입자가 근무한 기업에서 지급한 퇴직금과 본인이 추가로 납입한 개인납입금 모두에 대해 운용관리 수수료와 자산관리 수수료를 면제해 투자자들의 부담을 낮췄다.
8089,또 신분증만 있으면 삼성증권 모바일 앱 엠팝(mPOP)을 통해 별도의 소득증빙서류 제출 없이 계좌를 개설할 수 있어 가입이 편리하다.
8090,다이렉트IRP 고객들은 올해 들어 채권 투자를 대폭 확대한 것으로 나타났다.
8091,일정 기준에 부합하는 다이렉트IRP 신규 고객에게 편의점 기프티콘을 기존 고객 중 수익률 상위 고객에게 커피 기프티콘을 증정한다.
8092,이번 로드쇼는 농식품 유관기관이 보유한 각자의 스타트업과 투자정보 등을 통합해 제공함으로써 투자관련 정보의 비대칭성을 해소해 스타트업에게 효율적 투자정보를 제공하자는 취지다.
8093,투자설명회는 기업형 벤처캐피탈(CVC) 등 투자자를 초청해 스타트업과의 투자네트워킹을 구축하고 후속투자 유치를 목표로 진행된다.
8094,특히 제품시연회는 현장에서 국내 대기업 MD 액셀러레이터 등 전문가가 참여해 사업성 검증 유통‧판로 네트워킹 등이 동시에 이루어지도록 할 예정이다.
8095,농금원 민연태 원장은 “농식품 기술투자 로드쇼를 통해 농식품경영체의 기술 및 농식품 분야 혁신기술 기업을 발굴하고 효율적 투자정보 및 투자생태계 활성화에 기여하길 바란다고 말했다.
8096,경구용 표적항암제 베나다파립 등 신약 파이프라인 임상 개발을 진행 중이다.
8097,아이디언스 관계자는 베나다파립과 관련한 임상 개발 및 라이선스 아웃 추진과 함께 신규 물질 추가 확보를 통한 파이프라인 확대 등을 지속하겠다며 IPO를 대비한 투자 유치와 기업 가치 극대화에 역량을 집중할 계획이라고 말했다.
8098,설립 이후 미국 완성차 회사 포드 미국 딥테크 전문 벤처캐피탈 밀레니엄테크놀로지 등 글로벌 투자자와 국내 유수의 투자자들로부터 펀딩을 유치했다.
8099,유럽의 ADAS 도입 의무화 글로벌 부분 자율주행 기술 고도화 등에 힘입어 고성능 ADAS 도입 차량의 비중도 빠르게 높아질 전망이다.
8100,신한투자증권 관계자는 “동남아 최대 중고차 플랫폼 카로 유럽 바이오시밀러 제조사 알보텍 등에 지분 투자를 지속하고 있다며 “해외 상장 구주 매각 등을 통해 투자금을 일부 실현하기도 했다고 말했다.
8101,이홍재 현대차증권 연구원은 “가파른 조달비용 상승 등으로 순이자이익 개선 폭은 전분기 대비 약화되고 비이자이익은 환율 손실 등으로 감소했으나 주로 충당금 적립 규모가 경상 수준으로 회귀하며 실적 개선을 견인했다고 말했다.
8102,한국농업기술진흥원서울경제 농식품 분야 혁신 기술을 한눈에 볼 수 있는 ‘투자 로드쇼’가 서울에서 개최된다.
8103,이번 로드쇼는 농식품 유관기관이 보유한 각자의 기술을 스타트업에 효율적인 투자정보를 제공하기 위해 마련됐다.
8104,인공지능(AI) 기반 비대면 농장 모니터링 시스템을 개발한 경노겸 한국축산데이터 대표가 첨단 기술을 소개한다.
8105,또 데이터 기반 맞춤형 건강 티캡슐 추천 솔루션을 개발한 김하섭 메디프레스 대표와 정육 조직화 기술을 활용해 식물성 단백질 솔루션을 개발한 안현석 위미트 대표도 발표에 나선다.
8106,특히 이날 행사에는 기업형벤처캐피탈(CVC) 등 대형 투자자를 초청해 스타트업과의 네트워킹을 구축하고 후속 투자를 유치하기 위한 교류의 장도 열린다.
8107,제품 시연회 현장에서도 국내 대기업 액셀러레이터 등 전문가가 참여해 사업성 검증 유통·판로망 구축 등이 진행된다.
8108,홍성국 의원 올해 서울 주택 거래 절반은 갭투자전세를 끼고 집을 사는 이른바 갭투자가 임대보증금 등 부채 비율이 높은 고위험 거래가 대부분으로 주택값 하락 국면에서 피해가 커질 수 있다는 지적이 제기됐다.
8109,앞으로 주택 가격이 내리면 이런 높은 레버리지 투자자의 손실이 불가피하고 갭투자가 많이 이뤄진 지역일수록 주택 하락세가 더욱 커질 것이란 지적이 제기된다.
8110,홍 의원은 그동안 LTV·총부채원리금상환비율(DSR) 규제 등 주택담보대출 중심으로 부동산 시장을 관리한 정부의 접근 방식에 변화가 필요하다면서 우선 갭 투자에 대한 실태를 정확히 파악하고 정부가 세입자 보호에 노력해야 한다고 밝혔다.
8111,그는 “주가는 결국 내년 이후 ASP 상승 지속 여부에 초점을 맞춰 상승할 것이라며 “내년 신차부터 전개되는 무선 펌웨어 소프트 업데이트(FOTA) 적용이 차량 잔존가치와 더불어 새 주가 방향성을 제시하는 지표가 될 것이라고 내다봤다.
8112,배달 플랫폼 사용이 증가한 것 외에도 음식 제조 및 서빙 과정에 로봇이 투입되고 인공 기술이 도입된 스마트팜 내 식재료 재배 사례가 늘어났다.
8113,국내 푸드테크 산업은 글로벌 시장과 비교해 발전 단계에 머무른 것으로 나타났다.
8114,미국과 유럽권 국가에 비해 푸드테크 로봇 부문의 상용화 수준도 낮은 데 따른 결과다.
8115,다만 최근들어 삼성과 LG 현대로보틱스 등 주요 기업들이 음식 제조와 서빙 등에 투입되는 자동화 로봇 상용화에 나는 추세다.
8116,또 관련 투자가 이어지면서 푸드테크 로봇 부문 경쟁력이 증가할 것이란 전망도 나온다.
8117,삼일PwC경영연구원은 현재 국내 푸드테크 시장은 모바일 배달 플랫폼에 집중되어 있다며 대체식품과 푸드테크 로봇 등 새로운 산업 진출에 대한 투자에 속도를 내야 한다고 설명했다.
8118,기준금리가 빠르게 오르고 주가가 폭락하면서 주식 시장에서 빠져나온 돈이 대거 채권 시장으로 이동하고 있는 겁니다.
8119,몇십 억 원씩 자산을 굴리는 부자들은 이미 자기 자산의 절반 정도를 채권으로 옮겨탔다고도 하는데요 이덕영 기자가 취재했습니다.
8120,이OO/고액 자산가제 주위는 미리 채권을 작년부터 산 친구들도 있고 되게 많고 가면 갈수록 요새는 주식 얘기보다는 채권 얘기를 더 많이 하거든요.
8121,그런데 채권은 그냥 사놓고 만기까지 가거나 아니면 제가 싸게 샀다고 하니 비쌀 때 또 팔 수가 있다고 하니 괜찮은 것 같아요.
8122,정세호/한국투자증권 GWM센터 PB팀장인기 있는 채권들 같은 경우는 순식간에 완판되는 경우들이 상당히 많고요.
8123,금리가 낮은 채권들은 값이 많이 떨어져 나중에 시세차익을 노릴 수도 있습니다.
8124,김태윤/NH투자증권 PB 어드바이저저금리 시대에 발행했던 표면금리가 낮은 채권은 지금 가격이 많이 하락했기 때문에 가격 메리트가 있고요.
8125,심지어 한국은행 총재까지 나서서 위험한 해외투자 대신 채권투자를 권하기도 합니다.
8126,자금난을 겪는 회사들이 발행한 높은 금리의 채권을 샀다가 만약 회사가 무너지기라도 하면 휴짓조각이 될 수도 있습니다.
8127,이와 관련해 양측은 최근 국제 가스 시장의 불확실성이 커지는 상황에서 안정적인 공급망 확보가 중요하다고 짚었다.
8128,아울러 에너지와 인프라 중심의 양국 간 교역을 토대로 재생에너지 그린 수소 등 신산업 분야까지 협력을 넓히기로 했다.
8129,그러면서 가까운 시일 안에 한-오만 경제공동위원회를 열어 양국 간 주요 투자 성과 창출과 에너지 협력 강화의 계기로 삼자고 제안했다.
8130,또 한-GCC 간 자유무역협정(FTA)이 체결된다면 한국과 오만 간에도 경제·통상 관계를 뒷받침하는 제도적 기반으로 활용하며 양국 간 무역·투자가 확대할 수 있도록 노력하기로 했다.
8131,박완수 경남지사는 “기업·투자 유치는 경제 활성화의 기본이며 경남의 가장 중요한 도정과제라며 “파격적인 투자 인센티브 제공과 기업하기 좋은 환경 조성을 통해 경남에 투자한 기업들이 성공할 수 있도록 최선을 다하겠다고 말했다.
8132,네이버 제공파이낸셜뉴스 네이버 웨일이 신한투자증권과 협력해 웹(WEB) 기술력 기반의 편리한 금융플랫폼을 형성하는 데 나선다.
8133,네이버 웨일이 고도화해 온 웹 환경에서 신한투자증권의 새로운 금융플랫폼을 선보이고 학생들을 위한 경제금융 콘텐츠를 제공한다는 계획이다.
8134,신한투자증권은 웨일 브라우저 웹 애플리케이션(확장앱) 형식으로 새 금융플랫폼을 선보이기로 했다.
8135,웹 애플리케이션은 PC버전 웨일 브라우저 우측의 사이드 바 영역에서 작동하는 프로그램이다.
8136,웨일 스토어에는 △파파고 △바이브 등 네이버의 서비스와 더불어 사용자나 사업자가 개발해 등록한 앱이 등록돼 있다.
8137,양사가 구상 중인 금융플랫폼은 재미있게 익히고 사용할 수 있는 사용자인터페이스(UI)·사용자경험(UX)으로 설계될 예정이다.
8138,이 과정에서 네이버 웨일은 금융플랫폼에 필요한 다양한 기술 스펙을 지원하며 협업한다.
8139,아울러 양사는 학생들이 경제지식을 학습할 수 있는 다양한 콘텐츠를 네이버의 에듀테크(교육+기술) 플랫폼 웨일 스페이스에서 공개할 예정이다.
8140,신한투자증권의 업무환경에도 웨일이 축적한 웹 기술을 접목해 기업의 업무효율 증진을 돕는 온라인환경 도출을 위한 실험에도 나선다.
8141,김효 네이버 웨일 책임리더는 네이버 웨일이 보유한 웹 기술력은 교육 금융 등 여러 분야에서 요구되는 기술환경을 차질없이 지원할 수 있는 범용성이 특징이다며 신한투자증권과의 협업은 금융플랫폼 사용자에게 보다 편리한 사용성을 제공함과 동시에 웨일 브라우저의 활용범위를 새로운 영역으로 넓히는 의미가 있다고 전했다.
