,sentence
298,그러던 중 멤버들은 QR코드에 담긴 초대장을 받고 환호성을 질렀고 즉석에서 뉴진스 코드 in 부산의 포즈를 만들며 본격적인 여행의 시작을 알렸다.
299,송도 바닷가에 도착한 뉴진스는 한껏 상기된 표정으로 풍경을 감상하고 부산에 도착한 느낌을 상황극으로 표현하는 등 여행의 즐거움을 만끽했다.
300,이어 부산의 명물 돼지국밥을 먹으러 간 뉴진스는 한층 업된 기분으로 연신 국밥을 연호하면서 가게로 입성했다.
301,민지는 멤버들 중 가장 작은 도구인 숟가락에 당첨된 다니엘을 위해 정성스럽게 숟가락에 최대한 많은 돼지고기를 얹어 주며 돈독한 우정을 자랑했다.
302,시장에서의 미션을 확인하던 뉴진스는 미션 내용에 화음을 넣으면서 읽어 완벽한 호흡을 보여 주었다.
303,시장에서 민지 하니 혜인은 패션 아이템 쇼핑에 빠졌고 다니엘과 해린은 간식 먹방을 펼쳤다.
304,이날 방송에서의 마지막 미션은 제트보트 탑승 중 드론에 매달린 키워드를 읽고 속담을 맞추는 것.
305,보트 탑승에 앞서 뉴진스는 구명조끼와 우비를 매치한 패션으로 즉석 워킹을 펼쳐 현장을 런웨이로 만들었다.
306,제트보트 탑승 후 멤버들과 정답을 외치러 온 해린은 속담이 떠오르지 않자 당당한 표정으로 새로운 속담을 만들어 틈새 예능감을 뽐냈다.
307,이후 저녁식사 힌트를 받은 뉴진스는 각자 아이디어대로 추측했고 이어 다음 회차 예고로 루지를 타고 분수대에서 즐겁게 노는 멤버들의 모습이 나와 기대감을 높였다.
308,사진SBS 방송 화면 캡처* YTN star에서는 연예인 및 연예계 종사자들과 관련된 제보를 받습니다.
309,그룹 뉴진스의 스타일링과 관련해 비판의 목소리가 커지자 담당 스태프가 해명에 나섰다.
310,이날 뉴진스는 짙은 화장과 화려한 색의 의상을 입어 팬들의 이목을 끌었다.
311,행사 의상이 공개되자 일부 커뮤니티에선 스타일리스트를 향한 비판의 목소리가 제기됐다.
312,해당 누리꾼들은 “의상이 너무 과한 것 아니냐 “화장이 너무 안 어울린다등 따가운 시선을 보냈다.
313,이에 담당 메이크업 아티스트는 이날 인스타그램에 “간밤에 댓글을 비롯한 여러 의견을 보며 정확하게 알려드려야 혼선이 없으실꺼라 판단된다라며 해명글을 올렸다.
314,아티스트는 “KCON 현지 뉴진스 메이크업은 저를 비롯한 저희 스태프들과 관련이 없으며 제가 한 메이크업이 아님을 알려드린다라고 해명했다.
315,뉴진스는 이날 에이티비오·디케이지·프로미스나인·아이브·제이오원·투모로우바이투게더와 함께 공연 무대를 열었다.
316,이날 팝업 현장에는 배우 이이경 댄서 리정을 비롯해 가수 로꼬 그레이 쌈디 우원재그룹 뉴진스(민지 하니 다니엘 해린 혜인)가 참석해 자리를 빛냈다.
317,이날 팝업 현장에는 배우 이이경 댄서 리정을 비롯해 가수 로꼬 그레이 쌈디 우원재그룹 뉴진스(민지 하니 다니엘 해린 혜인)가 참석해 자리를 빛냈다.
318,콘서트 첫 날은 아이앤아이·기현·르세라핌·엔믹스·옥토퍼스·티엔엑스·티오원·비비지가 공연을 펼친다.
319,이튿날은 에이티비오·디케이지·프로미스나인·아이브·제이오원·뉴진스·투모로우바이투게더가 마지막 날은 에이티즈·브레이브걸스·다크비·조유리·케플러·니쥬·템페스트가 무대를 선보인다.
320,이날 팝업 현장에는 배우 이이경 댄서 리정을 비롯해 가수 로꼬 그레이 쌈디 우원재그룹 뉴진스(민지 하니 다니엘 해린 혜인)가 참석해 자리를 빛냈다.
321,아이돌 그룹 뉴진스는 영국 명품 브랜드 비비안웨스트우드의 골프의류를 입고 무대에 서기도 했다.
322,축제를 준비하며 대학별로 가장 심혈을 기울이는 부분은 이렇듯 연예인 섭외.
323,그렇다면 연예인을 섭외하는 데 얼마 정도의 비용이 들고 그 돈은 어디에서 지출되는 걸까.
324,&lt;오마이스타&gt; 취재 결과를 종합하면 국립대학교와 사립대학교의 축제 비용은 일반적으로 총학생회가 관리하는 학생회비에서 우선적으로 지출된다.
325,그러나 대부분의 학교에서 학생회비 납부가 의무가 아니기 때문에 학생회마다 예산이 상이하다.
326,그런 이유로 비용이 부족할 경우 등록금이 포함돼 있는 학교회계에 지원을 요청하기도 하다.
327,서울대학교 학생지원과 소속 한 관계자는 총학생회 중심으로 가수 섭외비 등 축제 예산안을 직접 짜고 있고 비용마련도 총학생회에서 주도한다면서 제휴업체로부터 받은 광고비와 후원금 총학생회비 등이 포함된 자체회계에서 먼저 축제 비용이 지불된다.
328,코로나 거리두기가 풀리면서 가수들의 몸값이 올라가서 재정이 부족한 경우도 있다.
329,사이먼 도미닉은 MBC &lt;라디오스타&gt;에 출연해 대학축제들에서 많은 수익을 얻고 있다고 말해 논란이 되기도 했다.
330,축제에 온 가수들을 보며 분위기에 한껏 들뜬 학생들이 대부분이었지만 학생회비와 등록금에서 연예인 섭외 비용이 나가는 것에 대해 부정적 시선도 존재한다.
331,축제에 꼭 비싼 연예인을 그렇게 많이 불러야 하는지도 잘 모르겠다며 회의적인 입장을 보였다.
332,축제에 연예인을 고액으로 섭외하는 것에 대한 입장을 묻는 질문에 몇몇 학교는 말을 아끼는 모습이다.
333,수도권 사립대 관계자는 가수들의 무대 이외에 다른 축제 프로그램도 마련했음을 밝히기도 했다.
334,다른 대학교가 축제 비용으로 얼마를 쓰는지 잘 모르기 때문에 과도한 건지 아닌 건지 객관적으로 알 수 없다.
335,단순히 연예인이 무대를 꾸미는 것만이 축제의 전부는 아니기 때문에 우리 학교는 단과대별로 참여할 수 있는 체육대회를 열어 학생들과 교수님들이 함께 어우러질 수 있는 축제 프로그램을 준비하기도 했다.
336,하지만 당일 캠퍼스에는 학생뿐 아니라 외부인들까지 한데 몰려 혼잡한 상황이어서 용의자를 잡는 데는 실패했다.
337,실제로 대학축제에는 재학생만이 아니라 무대에 서는 가수들의 팬들 즉 외부인들이 대거 몰리기 때문에 관객수가 포화상태에 이르는 경우가 다반수다.
338,재학생은 아니지만 무대를 보고자 하는 이들이 해당 학교의 학생증과 입장 팔찌 등을 돈을 지불하고 사는 것이다.
339,단과대 학생회가 공연장을 천막으로 둘러싸서 학생회비 미납자들의 관람을 막았다는 내용이었다.
340,한 온라인 커뮤니티에선 충북대학교 내에서 운영되는 익명 커뮤니티에 올라온 글을 전하는 게시물이 보이기도 했다.
341,글쓴이는 공연장 내부 좌석은 학생회비를 낸 학생만 입장할 수 있었다라고 주장했는데 이에 대해 학생회비로 주최된 행사인 만큼 회비를 안 낸 사람이 못 보는 건 당연한 것이라는 반응과 너무 했다 옳지 않다라는 반응으로 나뉘었다.
342,이에 계명대 재학생들은 차별이라며 강력하게 반발하고 나섰고 반발이 거세지자 계명대 총학생회 측은 관련 공지를 결국 삭제했다.
343,앞서 서울시립대도 학생회비를 낸 학생들이 축제 공연을 좋은 자리에서 관람할 수 있도록 시립존을 마련했다가 학생들의 반발로 철회한 바 있는데 이에 대해 총학생회 측은 행사를 학생회비로 준비하고 있지만 학생회비 납부자가 매우 적다.
344,학생회비를 납부한 학생들에게 아무런 혜택이 주어지지 않아 (혜택을 주기 위해 시립존을) 운영했던 것이라고 입장문을 내기도 했다.
345,일례로 중앙대는 학생들이 직접 주최하고 즐길 수 있는 플리마켓과 버스킹 공연 영화제 등을 선보였고 한국외대는 외대라는 특색에 걸맞게 세계 여행 부스들을 설치해 학생들이 각국의 문화를 간접 체험할 수 있도록 했다.
346,호남대는 부모님과 가족 친지 유학생 교직원 등이 다함께 어우러져 즐기는 호남대 패밀리 축제를 개최했다.
347,이 축제에서 선보인 다양한 프로그램 중 재학생이 부모님이나 형제 자매 친지 등과 함께 팀을 이뤄 경연에 참여하는 패밀리가요제가 특히 큰 호응을 얻었다.
348,호남대 총학생회 측은 학생들이 거리두기와 비대면 수업 등으로 오랫동안 힘든 시간을 보냈을 뿐 아니라 부모님도 함께 힘든 시간을 보냈다고 생각한다.
349,그래서 부모님과 함께 즐기며 소통하는 시간을 마련해 감사함을 전하려 했다라며 행사의 기획의도를 전한 바 있다.
350,‘New Jeans’의 수록곡 전곡은 발매 이후 단 하루도 빠지지 않고 ‘데일리 톱 송 한국’ 차트에 이름을 올리고 있다.
351,한편 민희진 대표이사가 이끄는 어도어(ADOR)의 걸그룹 뉴진스는 ‘New Jeans’ 발매와 동시에 전 세계를 아우르는 대세 아티스트로 부상했다.
