,sentence
148,이 같은 최근의 흐름은 방탄소년단의 진(본명 김석진)을 시작으로 한 군 입대 계획이 본격적으로 시작됐기에 더욱 큰 의미를 갖는다.
149,이처럼 하이브가 제시한 미래 청사진과는 별개로 최근 각 레이블들의 대표 걸그룹들이 크게 약진 중인 것이 눈에 띈다.
150,증권가 역시 이 걸그룹들의 행보 등에 주목하면서 하이브에 대한 가치를 긍정적으로 내다보고 있다.
151,먼저 하이브의 레이블 어도어에서 탄생한 신인 그룹 뉴진스(NewJeans)는 시작부터 파격적인 프로모션을 선보여 화제를 모았다.
152,이들은 데뷔와 동시에 어텐션 hype boy Cookie 등 세 편의 뮤직 비디오를 통해 멤버를 공개했다.
153,이에 더해 멤버의 과거 리스크까지 이어지면서 적지 않은 우여곡절을 겪어야 했다.
154,이러한 후배 걸그룹들의 약진에도 불구하고 탄탄한 팬덤을 보유 중인 프로미스나인의 꾸준함도 칭찬할 만하다.
155,앞서 밝힌 하이브 레이블 산하 세 걸그룹들의 행보를 보면 앞으로 이들의 비중은 점점 커질 전망이다.
156,방탄소년단의 부재가 확실시 된 현재 하이브는 아이러니하게도 걸그룹 명가가 될 절호의 기회를 맞았다.
157,과연 이 세 팀의 걸그룹은 큰 오빠들(BTS)의 빈 자리를 조금이나마 채울 하이브의 미래 먹거리로 성장할 수 있을까.
158,사진OSEN* YTN star에서는 연예인 및 연예계 종사자들과 관련된 제보를 받습니다.
159,한편 민희진 대표이사가 이끄는 어도어(ADOR)에서 선보인 뉴진스는 ‘New Jeans’ 발매와 동시에 전 세계를 아우르는 대세 아티스트로 부상했다.
160,/사진정수정 인스타그램가수 겸 배우 정수정(크리스탈)이 어도어 CEO 민희진과 생일 파티를 공개했다.
161,정수정이 그룹 에프엑스로 활동하던 시절 A&amp;R로 있던 민희진과 작업 다수 앨범으로 좋은 성적을 거뒀다.
162,스카이파크 전망대·마린 어드벤처 파크·청사포… 걸그룹 뉴진스가 SBS 예능프로그램 ‘뉴진스 코드 in 부산’을 통해 부산 여행기를 공개해 인기를 끌고 있다.
163,사진제공｜SBS 걸그룹 뉴진스(민지·하니·다니엘·해린·혜인)가 최근 방송하는 SBS 예능프로그램 ‘뉴진스 코드 in 부산’(뉴진스 코드)을 통해 부산 곳곳에 숨겨진 관광명소를 소개해 눈길을 끈다.
164,이들의 발자취를 뒤따르는 팬들이 각종 SNS에 인증샷을 잇따라 올리면서 해당 장소들이 벌써 ‘핫 플레이스’로 발돋움하고 있다.
165,또 부산의 명물인 돼지국밥을 즐기고 루지를 타고 도로를 질주하는 모습으로 ‘반전’도 선사한다.
166,이들이 프로그램을 촬영한 송도 스카이파크 전망대 영도 마린 어드벤처 파크 전포공구길 청사포 등대 대대포 낙조분수쇼 등에는 이미 팬들의 발길로 북적이고 있다.
167,부산시티투어버스를 이용하는 방법이나 멤버들이 부평깡통시장에서 사먹은 물떡 호두과자 등 각종 먹거리를 판매하는 점포 등에 대한 정보도 각종 SNS에서 끊임없이 공유되고 있다.
168,이들이 방문한 장소마다 설치된 QR코드를 찍어 각종 미션을 따라한 후 개인 SNS에 인증샷을 올리면 된다.
169,송도 영도 전포 광안리 등 촬영지여행코스 개발하고 SNS 이벤트K-POP 스타 뉴진스가 부산에서 촬영한 ‘뉴진스 코드 in 부산’의 장소들이 여행 코스로 개발된다.
170,부산관광공사 제공공사는 프로그램 속 촬영지인 ▷송도 스카이파크 전망대 ▷영도 마린 어드벤처 파크 ▷부산시티투어버스(부산역 정류장) ▷전포공구길(청년플래닛) ▷광안리 관광안내소(드론쇼) ▷해운대리버크루즈 ▷청사포 등대 일대에 이벤트 미션을 확인할 수 있는 QR코드 입간판을 설치했다.
171,미션을 따라 여행 인증샷을 촬영하고 개인 SNS 계정에 업로드하면 이벤트 참가가 가능하다.
172,공사 관계자는 “글로벌 관광도시 부산을 알리기 위한 사업의 일환으로 제작한 이번 예능 프로그램의 촬영지를 신규 부산 여행코스로 개발해 국내외 여행객 대상으로 다양한 프로모션을 진행할 계획이라며 “관광객 유치 확대를 위해 숨겨진 부산 관광지를 지속적으로 발굴하고 알리겠다고 말했다.
173,두 번째 에피소드에서는 뉴진스가 부산에서만 맛볼 수 있는 ‘갈삼구이(갈미조개+삼겹살)’를 맛보고 다대포의 낙조분수쇼를 감상하는 모습이 담길 예정이다.
174,진옥동 행장 모든 연령층이 이해할 수 있도록 쉽게 만들어 그룹 뉴진스/ 사진제공어도어신한은행의 애플리케이션(이하 앱) 신한 쏠(SOL)이 신한 뉴쏠(New SOL)로 새롭게 바뀐다.
175,바뀐 앱은 고객이 원하는 대로 홈화면을 구성하는 등 개인의 스토리를 담을 수 있도록 한 것이 특징이다.
176,신한은행 측은 은행의 앱이 아닌 고객의 앱으로 금융 앱 패러다임을 고객 중심으로 전환하기 위해 노력했다고 설명했다.
177,또한▲고객이 직접 원하는 메뉴로 홈 화면을 구성하는 ‘나만의 홈 화면’ ▲수취인을 계좌번호가 아닌 친구 그룹으로 등록해 바로 이체할 수 있는 ‘뉴 이체’ ▲거래 내역에 나만의 스토리를 담아 기록 공유할 수 있는 ‘스토리 뱅크’ 등 새로운 서비스를 선보인다.
178,신한은행 본점 건물신한은행은 뉴쏠 출시를 기념해 이날 오전 은행 본점에서 고객 자문단과 언팩 세러머니(Unpack Ceremony)를 진행했다.
179,행사는 조용병 신한금융그룹 회장의 고객 자문단에 대한 감사 인사를 시작으로 진옥동 신한은행장의 뉴 쏠 개발 철학 키노트 스피치 뉴 쏠 개발에 함께한 고객과 직원의 개발 스토리 &amp; 토크쇼 순서로 진행됐다.
180,이날 행사에 참석한 진옥동 은행장은 어려운 금융 용어는 지우고 모두가 이해하기 쉽게 표현하기 위해 노력했다며 글씨 크기도 더욱 확대해 고령층들도 편하게 사용하실 수 있도록 했다고 말했다.
181,이어 고객과 함께 만드는 쏠의 진화는 앞으로도 계속될 것이라며 누구나 더 쉽고 편안하게 새로운 금융을 누릴 수 있도록 최선의 노력을 다하겠다고 덧붙였다.
182,특히 이번 행사에서는 뉴 쏠 광고모델인 걸그룹 뉴진스(New Jeans)의 광고를 최초 공개하고 핵심 기능을 체험할 수 있는 체험존 고객과 함께 할 수 있는 포토존 등 다양한 이벤트를 준비했다.
183,신한은행 관계자는 뉴 쏠이 고객에게 제공되는 앱이 아닌 고객이 제작하는 앱의 시작이 되었으면 한다며 언팩 행사 또한 뉴 쏠(New SOL)의 시작부터 함께 해주신 고객에게 가장 먼저 공개한다는 취지로 기획했다고 강조했다.
184,com *재판매 및 DB 금지서울뉴시스정진아 인턴 기자 그룹 뉴진스가 멤버들 간 케미 넘치는 모습을 보여준다.
185,멤버 해린의 미션을 들은 나머지 멤버들은 해린이가 그런 말을 하는 애가 아닌데라며 놀란다.
186,다음날 아침 일찍 일어난 멤버 민지와 혜인은 광안리 해변에서 산책을 즐긴다.
187,루지를 타기 위해 이동하는 차 안에서 멤버 다니엘은 루지 타러 간다~나는 신난다~라는 노래를 즉석에서 만들어 다같이 부른다.
188,높이 올라가는 리프트에서 겁먹은 혜인에게 민지는 언니가 잡아줄게라고 다독여준다.
189,사진 큐브엔터테인먼트 (여자)아이들((G)I-DLE)과 르세라핌(LE SSERAFIM)이 컴백 돌풍을 일으켰다.
190,연관 키워드로는 ‘곡이 돋보이는’ ‘존재감을 과시하는’ ‘글로벌한 인기를 얻는’ 등이 있다.
191,글로벌차트에선 르세라핌의 ‘안티프래자일’(ANTIFRAGILE) 순위가 높았지만 음반판매량과 국내 기반의 써클지수에선 (여자)아이들이 앞섰다.
192,세계인은 어떤 K팝을 가장 많이 들을까 셀 수 없이 많은 미디어를 타고 흐르는 K팝.
193,대한민국 대표 대중음악차트 써클차트(구 가온차트)는 국내 음원차트(멜론ㆍ벅스ㆍ바이브ㆍ지니ㆍ플로)에 애플뮤직ㆍ스포티파이ㆍ유튜브까지 글로벌 플랫폼의 차트 데이터를 받아 전 세계에서 인기 있는 K팝을 매주 집계하고 있다.
194,앨범차트는 유통사와 소속사를 통해 데이터를 제공 받아 국내외 출고량을 줄세운 지표다.
195,국내 유통되는 모든 음악을 다루며 공개된 데이터에 더해 소속사와 유통사만이 가진 비공개 데이터도 분석을 통해 신뢰성을 더했다.
196,com사진 영상 제보받습니다 공감언론 뉴시스가 독자 여러분의 소중한 제보를 기다립니다.
197,뉴진스는 매일 찾게 되고 언제 입어도 질리지 않는 진(Jean)처럼 시대의 아이콘이 되겠다는 포부와 ‘New Genes’가 되겠다는 각오를 팀명에 담은 그룹이다.
198,이들은 힙하고 트렌디한 패션과 풋풋하면서도 자연스러운 이미지로 데뷔와 동시에 각종 차트를 휩쓸며 인기를 끌었다.
199,최종적으로 시사저널 편집국에서 올 한 해 미디어에 나온 여러 자료를 검토하고 검증하는 과정을 거쳤다.
200,매일 찾게 되고 언제 입어도 질리지 않는 진(Jean)처럼 시대의 아이콘이 되겠다는 포부를 담은 신인 그룹.
201,검은 생머리와 옅은 화장 스포티한 의상은 다른 걸그룹의 콘셉트와 차별화된다.
202,다른 그룹들이 걸크러시 콘셉트를 강조한다면 뉴진스는 풋풋한 소녀들의 자연스러운 느낌을 내세운다.
203,영상 속 윤은혜는 그륩 뉴진스의 노래 Hype boy의 안무를 완벽하게 소화해내 눈길을 끌었다.
204,윤은혜는 이어 아프리카 다녀와서 막막차 탄 Hype boy 더이상 막차는 없겠죠?
205,ㅋㅋ;; 이름하여 MZ세대가 함께 춘 하잎뽀이 z세대 칭구는 한 번 보고도 안무를 따네요.
206,ㅎㅎㅎㅎ 시험 공부 중이라 바쁘지만 함께해준 시영아 거마워 #하입보이 #뉴진스 #댄스커버라 덧붙이며 지인에게 고마움을 표했다.
207,한편 윤은혜는 최근 MBC 놀면 뭐하니?에 출연 프로젝트 그룹 WSG워너비 멤버로 활동했다.
208,/이새롬 기자 하반기 가요계를 강타하고 있는 그룹 뉴진스(NewJeans)에게 따라붙는 수식어는 괴물 신인이다.
209,이에 민지 하니 다니엘 해린 혜인 등 다섯 멤버들은 수상 이후 진행된 &lt;더팩트&gt;와 인터뷰에서 시종일관 환한 미소를 보이면서 기쁜 마음을 감추지 못했다.
210,뉴진스가 이날 꾸민 무대는 댄스챌린지 열풍을 몰고 온 하입 보이(Hype Boy)와 큰 사랑을 받은 대표곡 어텐션(Attention).
211,혜인은 데뷔하기 전에 저희끼리 연습을 열심히 했는데 기대보다 너무 많은 분들께서 저희가 공유하고 싶은 음악을 많이 사랑해주시고 저희 무대를 보고 밝은 에너지를 함께 느끼실 수 있는 것 같아서 너무 뿌듯하다.
212,데뷔와 동시에 큰 스포트라이트를 받으면서 앞으로 뉴진스의 행보를 기대하는 이가 더 많지만 그 만큼 하고 싶은 것이나 먹고 싶은 것이 많을 나이다.
213,밥은 먹고 다니는 지 걱정하는 팬들을 위해 지금 이 순간 가장 하고 싶은 것이나 먹고 싶은 게 있는 지 물었다.
214,멤버들은 붕어빵이라는 단어가 나오자 모두 환호하면서 영락없는 소녀처럼 깔깔 댔다.
215,막간을 이용해 팥과 슈크림 붕어빵을 두고 밸런스 게임을 진행했더니 혜인 다니엘 해린은 팥을 민지와 하니는 슈크림을 골랐다.
216,되게 여유롭게 책도 읽거나 맛있는 걸 먹고 하면 힐링되고 좋을 것 같다고 했고 하니는 제가 호주에 있을 때 밤에 겨울 바다를 자주갔다.
217,멤버들도 (산책을)좋아해서 꼭 멤버들과 같이 밤 산책을 해보고 싶다며 소망을 내비쳤다.
218,그런데 이제 겨울이니까 멤버들과 다같이 아이스스케이팅 장을 가서 핫초코를 먹고 싶다며 밝게 웃었다.
219,뉴진스는 데뷔하자마자 괴물 신인으로 불리지만 앞으로의 미래가 더욱 기대되는 팀이다.
220,민지는 많은 팬분들 앞에서 되게 신나는 음악과 함께 저희 콘서트를 꼭 해보고 싶다.
221,저희 뉴진스의 음악과 좋아해주시는 분들이 함께 있는 콘서트라면 너무너무 행복할 것 같다고 말했다.
222,신한은행은 이날 오전 서울 중구 본점에서 개발 과정에 함께 참여한 고객들과 기념행사를 열었다.
223,조용병 신한금융그룹 회장도 이날 행사에 참석해 고객 자문단에게 감사의 말을 전했다.
224,진옥동 신한은행장도 이 자리에서 뉴 쏠 개발 철학 키노트 스피치와 뉴 쏠 개발에 함께한 고객과 직원의 솔직한 개발 스토리 &amp; 토크쇼 등에 참여했다.
225,특히 이번 행사에서 뉴 쏠 광고모델인 걸그룹 뉴진스(New Jeans)의 광고도 처음으로 공개됐다.
226,신한은행 관계자는 뉴 쏠(New SOL)이 고객에게 제공되는 앱이 아닌 고객이 제작하는 앱의 시작이 됐으면 한다며 앞으로도 고객이 원하는 더 쉽고 더 편안한 더 새로운 금융을 향해 끊임없이 노력하겠다고 말했다.
227,▲ 출처| 크리스탈 인스타그램스포티비뉴스정혜원 인턴기자 그룹 에프엑스 출신 배우 크리스탈(정수정)이 생일파티 모습을 공개했다.
228,▲ 출처| 크리스탈 인스타그램특히 뉴진스 소속사 대표이사 민희진과 함께 찍은 사진을 공개해 관심을 모았다.
229,앞서 민희진은 SM엔터테인먼트 크리에이티브 디렉터로 일하며 크리스탈이 속한 에프엑스 앨범 디렉팅을 맡은 바 있다.
230,두 사람은 SM엔터테인먼트에서 나간 후에도 여전히 우정을 이어오고 있는 것으로 보인다.
231,민희진은 하이브 산하 신규 레이블 어도어 대표이사로 민희진 걸그룹이라고 불리는 뉴진스를 탄생시켜 많은 인기를 얻었다.
232,뉴진스 유튜브 채널에는 데뷔 후 뉴진스가 리얼리티 프로그램에서 같이 해 보고 싶었던 일을 즐기는 모습을 담은 ‘NewZips’를 비롯해 앨범 제작 비하인드를 담은 ‘Making Jeans’ 기획형 웹 예능 ‘Jeans’ ZINE’ 제작과 다양한 활동 비하인드를 가볍게 담은 ‘Light Jeans’ 등 뉴진스의 매력을 가득 담은 다채로운 콘텐츠가 업로드돼 있다.
233,뉴진스는 ‘NewZips’를 통해 데뷔 활동 비하인드부터 왁자지껄 캠핑 서로의 버킷리스트 룩을 완성해 준 빈티지 숍 쇼핑까지 멤버들의 있는 그대로의 모습과 발랄한 예능감을 보여주고 있다.
234,우리은행이 가수 아이유를 모바일 뱅킹 모델로 앞세워 월활성이용자수(MAU) 확대 효과를 톡톡히 누리자 은행권의 빅모델 섭외 경쟁이 본격화했다는 분석이 나온다.
235,‘뉴진스’는 각종 국내외 주요 음원차트에서 신기록을 갈아치우며 돌풍을 일으키고 있는 신인 걸그룹으로 데뷔앨범 ‘뉴 진스(New Jeans)’ 발매와 동시에 라이징 K팝 그룹으로 급부상했다.
236,신한은행은 세대 불문 남녀 노소 모두에게 사랑받아온 Jean(진·청바지)같은 시대의 아이콘이 되겠다는 뉴진스의 이미지가 더 빠르고 쉽고 편하게 이용할 수 있는 금융의 아이콘으로 새롭게 태어나는 쏠(SOL)과 부합해 광고모델로 발탁했다.
237,더 빨라진 속도와 함께 ▲나만의 화면구성 ▲스토리뱅크 ▲뉴 이체 등 새롭고 다양한 서비스를 제공하게 된다.
238,신한은행 관계자는 “쏠(SOL)의 새로운 시작을 매력적인 음악과 스타일로 전세계의 주목과 사랑을 받고 있는 뉴진스와 함께하게 되어 더욱 기대된다며 “시대의 아이콘으로 자리잡고 있는 뉴진스처럼 신한 쏠(SOL)도 고객에게 새로운 경험을 선사하는 금융의 대세 아이콘으로 자리잡는 금융플랫폼이 되길 바란다고 했다.
239,팬들은 짙은 화장 어색한 염색 알록달록한 의상이 이들과 어울리지 않는다고 지적했다.
240,글쓴이는 ‘멤버들은 무대뿐만 아니라 광고 화보 예능에서까지 메이크업 테러를 당하고 있다’고 비판했다.
241,칙칙한 화장과 어색한 머리 스타일로 수차례 공식석상에 선 데다 지난달 컴백을 앞두고 공개된 콘셉트 사진에서 멤버들의 ‘퍼스널 컬러’(피부 톤과 어울리는 색상)를 고려하지 않은 메이크업을 한 게 도화선이었다.
242,이들은 “아이돌은 내가 직접 키운다는 생각으로 구체적인 의견을 적극적으로 표현한다.
243,멤버에게 스타일링이 어울리지 않을 경우 소셜네트워크서비스(SNS)에 비판하는 글을 올리거나 해시태그를 통해 집단행동을 해 소속사의 의사 결정에 영향을 미치고 있다.
244,아이브 멤버 안유진의 콘셉트 사진을 본 팬들은 “연갈색 머리와 눈썹 연분홍색 메이크업이 답답해 보인다고 비판했다(왼쪽 사진).
245,스타쉽엔터테인먼트 제공 아이브의 메이크업과 관련해 한 팬은 트위터에 멤버 안유진이 붉은색 입술 검은색 머리를 했을 때의 생기 있는 사진과 베이지색 화장 연갈색 머리를 했을 때의 칙칙한 사진을 비교해 올렸다.
246,장원영은 홍보모델로 활동하고 있는 주얼리 브랜드 화보 사진에서 잘못 자른 듯한 잔머리 지저분한 눈썹으로 등장해 “나이 들어 보인다는 팬들의 비판을 받았다.
247,‘민희진 걸그룹’으로 돌풍을 일으킨 뉴진스의 헤메코 담당자도 논란의 중심에 섰다.
248,갈색 머리 짙은 색조 화장 지나치게 알록달록한 의상과 털모자에 팬들은 “레트로를 넘어 각설이가 됐다며 강하게 비판했다.
249,소수의 강력한 팬덤이 여론을 좌우하는 K팝 시장의 특성상 소속사와 관계자들은 팬들의 지적에 촉각을 곤두세우고 있다.
250,아이브 메이크업 담당자는 SNS 라이브 방송에서 “아이브 친구들에게 미안하다.
251,뉴진스의 메이크업 담당자는 자신의 SNS에 ‘일본에서의 뉴진스 메이크업은 저희 스태프와 관련 없으며 제가 한 메이크업이 아닙니다’라는 해명을 올렸다.
252,팬들의 지적이 이어지자 아이브의 메이크업은 멤버의 장점을 살리는 방향으로 바뀌었다는 반응이 나왔다.
253,이런 팬들의 행동은 자신의 의사를 적극적으로 표출하는 Z세대의 특성에서 비롯됐다.
254,소속사는 팬들의 조언을 일정 부분 받아들이되 그룹의 정체성은 유지하도록 적절한 수준을 판단해야 한다고 말했다.
255,이날 행사에는 그룹 뉴진스(민지하니다니엘해린혜인)와 래퍼 로꼬 그레이 쌈디 우원재 댄서 리정 배우 이이경 등이 참석했다.
256,이날 행사에는 그룹 뉴진스(민지하니다니엘해린혜인)와 래퍼 로꼬 그레이 쌈디 우원재 댄서 리정 배우 이이경 등이 참석했다.
257,이날 행사에는 그룹 뉴진스(민지하니다니엘해린혜인)와 래퍼 로꼬 그레이 쌈디 우원재 댄서 리정 배우 이이경 등이 참석했다.
258,소속사 BH엔터테인먼트에서 한솥밥을 먹고 있는 탤런트 이지아가 첫 게스트로 등장했다.
259,특히 김고은은 팬들의 요청으로 그룹 뉴진스의 하입 보이(Hype Boy) 댄스 무대를 선보였다.
260,이 외 영화 은교 정지우 감독과 유미의 세포들 안보현과 그룹 갓세븐 박진영 작은 아씨들의 박지후와 함께 추억을 풀어냈다.
261,이소라의 사랑이 아니라 말하지 말아요와 레이디 가가의 아윌 네버 러브 어게인(I‘ll Never Love Again)으로 팬미팅을 마무리했다.
262,김고은은 tvN 드라마 작은 아씨들 종방 후 영화 파묘(감독 장재현) 촬영에 들어갔다.
263,가수 브랜드평판지수는 소비자들에게 사랑받는 음원을 선보이고 있는 가수 브랜드 빅데이터를 추출하고 소비자 행동분석을 하여 참여가치 소통가치 미디어가치 커뮤니티가치로 분류하고 긍부정비율 분석과 평판분석 알고리즘을 통해 분석된 지표이다.
264,브랜드 평판분석을 통해 브랜드에 대해 누가 어디서 어떻게 얼마나 왜 이야기하는지를 알아낼 수 있다.
265,자신만의 방식으로 연두의 첫사랑 백현진(박정우)의 모든 것을 알아내기 위해 고군분투 하지만 계획대로 되지 않자 백현진의 절친 풍운호(변우석)를 공략하면서 예상치 못하게 로맨스에 빠지게 되는 소녀를 연기 새로운 첫사랑의 아이콘으로 등극했다.
266,평소에도 예전 음악들이나 감성을 좋아했고 내가 그 안에 경험해보면 어떨까?
267,라는 기대감이 커 작품을 선택하게 됐다며 촬영하면서 의상 등 레트로한 분위기를 즐기면서 연기하기도 했고 개인적으로 그런 감성이 너무 좋았다.
268,이어 실제로 어렸을 때 공중전화 같은 부분은 초등학교 때 쓴 기억도 있다.
269,주인공의 주요 배경인 보라비디오를 통해 영화 비디오를 보는 것도 신기했다.
270,박혜경 박기영 양파 등 테이프를 모이기도 했고 예전 팝송들을 LP로 가지고 있다.
271,내 노래방 애창곡 중 하나가 박기영의 마지막 사랑 박혜영의 하루 등이 있다.
272,보통 현장에서 선배들과 촬영하는 경우가 많은데 쉬는 시간 함께 예전 노래를 들으며 많이 알게 됐다.
273,선배들이 나를 두고 옛날 감성이다 애늙은이다라는 말을 많이 하더라고 웃었다.
274,연기를 하면서 학교에 다니기 어려운 지점도 있었지만 개인적으로는 학교 다니는 걸 굉장히 좋아했다.
275,이어 물론 친구들이 나를 대할 때 어려움이 없지 않았겠지만 처음에만 그렇고 나중에는 다른 친구들과 똑같이 생각해줬다.
276,시간이 지나면서 나도 더 그 친구들을 이해하게 됐다며 실제로 학교에 다닐 때 친했던 친구 그룹이 있다.
277,당시 중학생이었는데 친구들과 춤추면서 연습하고 맛있는 것 먹고 놀러 다니고 한 게 아직도 그 추억에 대한 힘이 남아있는 것 같다.
278,그 친구들과는 아직도 모여서 파티도 하고 새해 축하도 연말 축하도 하고 서로 응원해주는 관계로 지내고 있다.
279,그는 내가 배우라는 생각을 안 할 정도로 친구들도 너무 좋았고 학교도 촬영도 너무 좋았다.
280,예쁘게 보여야겠다는 생각은 전혀 안 했는데 오히려 그 부분이 자연스럽게 나온 것 같다.
281,최근 많은 인기를 얻은 걸그룹 뉴진스를 향한 관심을 드러낸 김유정은 뉴진스를 개인적으로 정말 좋아한다.
282,데뷔하자마자 팬이 됐고 멤버들 모두 좋아하는데 특히 멤버 다니엘과 내가 닮았다는 이야기를 많이 들었다.
283,그 친구가 스타일링에 따라 달리 보이던데 특유의 풋풋한 느낌이 너무 좋다.
284,뉴진스가 데뷔하자마자 유튜브를 통해 몇 번을 돌려봤는지 모르겠다고 너스레를 떨었다.
285,아끼는 친구들 때문에 그렇게 하는 것일 수도 있지만 우정도 사랑과 비슷한 결이라고 생각한다.
286,개인적으로 내가 이 연기 활동하면서 가장 큰 힘이 된 게 친구들이었다고 밝혔다.
287,다만 보라처럼 아련한 첫사랑 수 없는 게 지금 시대에서는 그런 사랑이 쉽지 않다.
288,많은 분이 첫사랑 이미지가 잘 산 것 같다고 칭찬해주니까 기분이 너무 좋더라.
289,지금 이 시기가 나에게는 굉장히 풋풋하고 예쁘게 표현될 수 있는 시기라고 생각한다.
290,거기에 걸맞은 작품을 만났고 참여하게 되면서 지금만 낼 수 있는 분위기가 작품에 잘 표현된 것 같다고 만족감을 드러냈다.
291,어느덧 국민 여동생에서 국민 첫사랑으로 성장한 김유정은 평소에 나는 무언가가 되어야겠다라는 생각은 많이 하지 않는다.
292,어렸을 때 감사하게도 국민 여동생이라는 수식어가 붙어있었으니까 그것도 너무 좋았다.
293,이 작품으로 국민 첫사랑 타이틀을 얻을 수 있을지 모르겠지만 만약 가능하다면 너무 좋을 것 같다고 고백했다.
294,엔딩에 대한 호불호가 많다고 들었는데 그건 내가 관여할 수 있는 부분도 아니었고 연기하는 배우로서는 작품을 있는 그대로 받아들이려고 했다.
295,김유정 변우석 박정우 노윤서 등이 출연했고 방우리 감독의 첫 장편 연출 데뷔작이다.
296,뉴진스(NewJeans)가 발랄한 매력으로 데뷔 후 첫 단독 예능 프로그램을 가득 채웠다.
297,이들은 주어진 미션을 수행하면서 날카로운 심리전과 호흡이 척척 맞는 찰떡 케미스트리를 뽐냈다.
